id,text,date,likes,reposts,views
1528,Воспоминания о войне Поташовой Надежды Васильевны,2021-04-28 22:11:41,63,0,961
1527,Боевой путь Поташова Михаила Григорьевича в фотографиях,2021-04-28 21:37:59,68,2,1107
1525,1985 год. Воспоминания ветеранов. Осипов Павел Тихонович,2021-04-27 20:31:18,57,4,1020
1524,Воспоминания ветеранов. Семенов Павел Иванович.,2021-04-27 20:26:12,57,0,961
1518,"Нюхча. Встречи школьников с ветеранами ВОв, воспитание патриотизма.",2021-04-09 23:19:23,71,1,1617
1515,"Стихи от Надежды Федосеевой, автор не указан.",2021-04-08 15:37:48,95,17,2007
1506,Нюхча в прошедшем времени.,2021-03-30 19:53:39,47,2,1195
1504,Нюхотские активисты разных лет.,2021-03-29 20:17:46,59,5,1418
1499,"Нюхча. Экспедиция приехала? Может кто подскажет, кто эти люди, кроме известных нюхчан? Надеемся на Михаила Кудряшова, - он есть на снимке и просматривает новости в группе",2021-03-23 21:54:41,39,2,1373
1496,Может кто найдет знакомые фамилии....,2021-03-23 20:31:00,6,1,618
1492,"Нюхча. Лодку у деда угнали, а вот вёсла были убраны, так мы и лопатой грести можем! Мы же, правда, тут ни при чём, такая генетика у нас поморская, да?",2021-03-21 17:26:34,69,1,1384
1491,"""Ужу, ужу корешка, - попади наважка""",2021-03-21 17:13:52,29,2,725
1489,"Последний ряд, пятый слева - представитель от колхоза ""Беломор"" Поташов Михаил Григорьевич.",2021-03-20 18:28:44,50,5,1037
1485,"14 марта не только прокатная Масленица, а ещё непереходящий праздник Евдокеи - плющихи. ""Красна Евдокея, ветер с горы, - выворачивай оглобли"". С Евдокеи промышленники отправлялись на мурманские промыслы. Каждое ремесло в свою пору - женщины начинали ткать - ""Евдокеи - первоткеи""и белить холсты",2021-03-14 22:30:14,30,3,938
1483,"Нюхча, Масленница, 1947 год. Завтра ""Чистый понедельник"" - ""чистят"", доедают рыбные корки и стряпню. Девушки, раньше, ходили в дом к кавалерам, просили корок на одну из подруг у будущей свекрови. Ну, и, житьё посмотреть! Если девушка хозяйке была не по нраву, могла отказать в корках то, а если нравилась, могла и целый рыбник дать! Сама то невёста в это время на улушке стояла, в дом не входила.",2021-03-14 18:30:08,111,6,2695
1480,"Вчера , 11 марта 2021 года , скончался Сероносов Владимир Александрович. Светлая память замечательному человеку , горячему патриоту родного села. Прощание 13 марта 2021 года в 10-30 у дома Сероносовых.",2021-03-12 08:20:34,3,0,0
1479,"Страницы обновленного сайта «История рыбной отрасли Севера» http://rmpoisk.ru/ теперь открыты для всех мурманчан, нынешних и бывших, чьи судьбы связаны с рыбным Мурманом.",2021-03-10 06:23:03,8,0,0
1471,Нюхча. Защитники Отечества разных лет.,2021-02-23 18:43:09,104,7,1933
1452,Нюхча. Послевоенное фото. Учительница в белой кофте Анна Федоровна.,2021-02-08 19:51:04,96,6,2259
1438,Как быстротечна жизнь. Ушла из жизни Александра Константиновна Демьянчук. Скорбим по утрате.,2021-02-02 19:08:37,126,9,3020
1436,Нюхча. Сентябрь 1986 год. БральнИца за мостом на малопосадской сторонке.,2021-01-29 21:57:59,74,3,1657
1430,"Нюхча. Походы на природу. Вот весёлое было времечко, никаких смартфонов!",2021-01-28 20:54:08,76,3,1762
1429,"Ах, мать моя, мать, тебе нас не унять.  А мы люди молодые,  нам охота погулять.",2021-01-27 21:27:21,73,1,1395
1420,"Нюхча. Ремейки картин. У нас не было тогда такой цели - повторить картину известного художника, просто новый взгляд на фото",2021-01-26 20:59:53,61,0,1323
1418,Нюхча Фото воспитанников детского сада разных лет,2021-01-25 19:37:32,65,4,1391
1417,"Комсомол, это здорово, но! Яжемать! Дети тоже хотят в поход. Первый походный опыт - пеший ""тур"" на Середнюю, с ночевкой. Фото из семейного архива Т.Шмидт.",2021-01-21 20:43:23,63,3,1509
1414,"Нюхча. сорокалетней давности. Ежегодно на сенокосный период создавалась комсомольская бригада на заготовку сена для колхоза ""Беломор"". На правлении колхоза утверждали, сколько тонн сена должны были убрать комсомольцы. Учитель, библиотекарь, работник АТС, воспитатель, директор ДК , да хоть ты кто! - не менее двух дней, обязательно, все на сенокос!",2021-01-20 22:08:25,86,3,1577
1413,"Нюхча более 40 лет назад. Вокальная группа ДК с концертом на сенокосных угодьях колхоза ""Беломор"". Валдогора, Бригада Моисеевой Т.Н.",2021-01-19 20:32:30,75,3,1451
1410,"Нюхча. Поездка вокальной группы с концертом и политинформацией для рыбаков колхоза ""Беломор"", занятых заготовкой водорослей на островах Белого моря.",2021-01-18 21:08:43,56,2,1395
1409,"УРАААА! Нас уже больше тысячи!!! Тысячным подписчиком стала Светлана Ильина из Петрозаводска, для неё от администраторов группы будет небольшой подарочек. Спасибо всем подписчикам, за то, что вы с нами, за ваши новости, фотографии, комментарии!",2021-01-18 16:37:45,35,0,821
1403,"Поездка вокальной группы с концертом в Гридино, там тоже любят песни! Зима? Молодость и оптимизм не позволили замёрзнуть😊",2021-01-17 20:15:45,103,10,2574
1397,"Нюхча. Комсомольская жизнь. На следующий год решили на Вардегору попадать транспортом, колхозным, гужевым. Повод нашелся - концерт рыбакам надо, чтобы у них рыба лучше ловилась! Выделили на вокальную группу две лошади, баянист свой был - Тамара Анастасьева, и, вперед, с песнями, повышать производительность труда! А директор ДК, Татьяна Шмидт с крыльца еще и речь напутственную в дорогу произнесла. (ножки в третью позицию - для торжественности события, наверное).",2021-01-16 16:42:45,67,2,1477
1396,"Не бывали зимой в Двинском? (Кузнаволок) А давай ка сходим туда, - чайку попить! Хорошо было идти на Вардегору по накатанной дороге! А в Двинской зимней дороги не бывало тогда. По берегу не пошли - круг такой делать? Далекоооо! Вперед по торосам на лыжах! Пришли уже затемно, хорошо, что чай в термосе был. На фото и не разберешь, кто на чердаке в пастушьей избушке, а кто у порога, одна только шапочка моя белеет. Домой вернулись в 22 час, нас уже собрались искать. Вот, неугомонные!",2021-01-16 16:31:14,56,0,1230
1394,"Продолжим тему активной комсомольской жизни. В начале марта лыжный однодневный поход на Вардегору, - давно не бывали потому что!",2021-01-15 21:42:39,61,4,1158
1391,"Такая красота повсюду, но сегодня с утра морозец - 41!",2021-01-14 20:55:58,26,5,632
1390,Нюхча. Комсомольцы в воскресный день вышли на отдых - вместе попить чайку у костра. Накануне проходил субботник - подвозили песок и выравнивали волейбольную площадку у ДК,2021-01-14 20:49:10,88,8,1379
1386,"Село Нюхча. Фото 35-летней давности. Шествие первомайской демонстрации на Микольскую гору к памятнику односельчанам, погибшим в борьбе за Советскую власть в 1919 г.",2021-01-13 19:22:14,79,6,1388
1383,"Село Нюхча, лет, этак, 35 назад. Дом культуры. Новогодняя дискотека в ДК.",2021-01-12 20:21:07,128,10,1850
1381,"Сегодня в Нюхче от колокольни и на север по небу играют спОлохи. Жаль, крепкий морозец не даёт полюбоваться красивым северным сиянием!",2021-01-11 21:16:49,93,8,1327
1379,"Если здесь не Нюхча, то Сумпосад, а девчата могут быть нюхоцкие. Вторая слева - Коровкина Валентина Иннокентьевна, моя мама.",2021-01-10 11:32:04,8,2,0
1367,С Новым годом !,2020-12-31 17:19:00,15,1,593
1364,В Нюхчу погостить на Новый год приплыл тюлень😄,2020-12-31 12:20:01,58,5,861
1358,"Еще одно фото из маминого детства. Должно быть Нюхча. Дальше она училась в Сумпосаде. Надеюсь, кто-то узнает своих. Моя мама - первая слева в нижнем ряду, Коровкина Валентина, родилась в 1941. На фото 1950-е годы?",2020-12-29 13:53:49,10,2,0
1357,https://vk.com/wall-52853904_77767,2020-12-28 00:00:09,3,0,0
1356,Нюхча. Конец 50-х прошлого века. Девушки поморочки.,2020-12-27 17:51:56,75,6,1520
1353,"Два редких фото, и , удача, - с подписью Никифора Сотникова.",2020-12-24 22:24:37,48,4,1434
1351,"Здравствуйте! Делюсь одним из самых ценных фото из нашего семейного альбома. Фото, должно быть, 1944-1945 годов. Вторая справа в нижнем ряду - моя мама, Коровкина Валентина Иннокентьевна, она родилась в конце 1941 года. Надеюсь, кто-то узнает своих родных.",2020-12-24 12:19:45,11,0,0
1350,"🎶📣""Сказы поморского берега"" - вот таким ярким и незабываемым событием мы заканчиваем проект ""Окно в Поморье"" районного Дома культуры поддержанного Фондом Культуры Российской Федерации. 🇷🇺#сказыпоморскогоберега",2020-12-24 11:40:49,3,0,0
1349,"Нюхча. 60 годы прошлого века. МалопосАжене. Да, да, и в футбол погонять, в модных брючках, да на колхозных полях, то еще удовольствие!",2020-12-23 17:11:15,61,4,1507
1347,"Нюхча. После раскулачивания семьи Пономаревых Ивана Васильевича и Анны Степановны в их доме до ВОв и после, до конца 60-х двадцатого века, располагались больница и роддом. Ежегодно приезжал на свою малую родину и вел приём больных профессор Белоголовов. На снимках 1956 - 60гг работники больницы. Просьба к вам, друзья, - если кого узнали, сделайте отметки, пожалуйста!",2020-12-22 19:25:24,51,4,1464
1345,"📢📢📢 Вы до сих пор не решили где побывать в новогодние праздники? ☃❄ Тогда мы идем к вам!!!  Устами детей о ""Поморской горнице"" старинного села Сумский Посад Беломорского района! Собираем чемоданы и вперед на встречу с историей поморов! 👣  Фильм подготовлен в рамках проекта ""Окно в Поморье"" районного Дома культуры г. Беломорска при поддержке Фонда Культуры Российской Федерации.  #окновпоморье",2020-12-21 23:00:31,1,0,0
1344,"С праздником, наши участники! Сегодня празднование зимнего солнцестояния (21 декабря). Зимнее и летнее солнцестояния (21 июня) являются самыми древними из всех ритуалов человечества. На Николу зимнего последнее тепло падЁт, а с 21 - ""солнце - на лето, зима - на мороз!"" - настоящая зима наконец то придёт. Не переживайте, не надолго! На Рождество уж день прибудет на воробьиный скок. А ""с Крещенья уже цыган шубу продаёт"" - так раньше старики говорили.",2020-12-21 16:32:47,29,1,835
1343,"В Нюхче традиционно с утра на Троицу все идут на кладбище в Дедову гору. В этот день очень много народу приезжало в Нюхчу и так случалось, что можно было встретить друзей детства, одноклассников, дальнюю и близкую родню, да просто знакомых, с кем, можно сказать, сто лет не виделся. Троицкие фотографии разных лет. (Из семейного архива Кармановой Евгении)",2020-12-20 21:18:53,59,3,1342
1337,"Фото разных лет. Пожалуйста, узнавайте знакомых, подписывайте, комментируйте.",2020-12-18 21:21:30,40,1,1317
1331,"Нюхча. Середина семидесятых двадцатого века. У доярок колхоза ""Беломор"" фотосессия. Эти женщины доили коров и пропускали молоко через сепаратор. Сливки были желанным гостинцем, что везли из Нюхчи! Помните, наверное, вкуснейшие нюхотские сливки? (Из архива Кармановой Евгении)",2020-12-17 20:32:07,175,7,5687
1330,"Ну вот, посвадебили.... Далее трудовые будни. (Из архива Кармановой Евгении)",2020-12-16 20:55:48,69,3,1356
1326,"Постановочная свадьба в ЭКЦ ""Хламной сарай"" на Покров в 2016 году. Были разыграны сцены: сватовство, пониманье, рукобитье, ""башмаки"", приводной стол. При проведении каждого обряда исполнялись традиционные нюхотские свадебные песни. Участники: фольклорная группа ""Таволга"", ""жених"" - Сергей Семенов, ""невеста"" - Ирина Козлова, фольклорные группы из Сумского посада и Рабочего острова; поклонники и собиратели поморской культуры из Кеми и из Беломорска. В 2018 г, совместно с Центром Поморской культуры в рамках проекта, был выпущен диск ""По сеням-то было, сенечкам""",2020-12-15 18:59:45,118,5,2222
1322,"""Ах, эта свадьба, свадьба, свадьба, Пела и плясала""",2020-12-14 21:35:41,66,1,1719
1319,"Еще свадебные фото - рождение семьи Кичигиных Веры Михайловны и Владимира Ивановича Нюхча, апрель 1971г. До золотой свадьбы чуточку осталось! Давайте, пожелаем им здоровья!",2020-12-13 23:25:44,115,2,1842
1316,"""Само большо гостьбище - свадебно!""",2020-12-11 22:19:11,51,2,1322
1314,"""Бригадно"", ""госьба"" и ""привально"". Бывало отвально, именины, новоселье и еще много хороших поводов погулять. ""Литки пить"" - тоже приятный повод, да только теперь редко кто сделает такую торговую скидку, событие ушло в историю",2020-12-10 20:24:38,49,2,1519
1313,"Групповые фото ""на память"". Друзья, пожалуйста, подписывайте, если кого узнали.",2020-12-09 21:10:23,53,2,1204
1307,"Старенькие уже фотографии, но не совсем ""древние"" виды села. Ушли в историю безгвоздевые заборы из жердей ""журавлинное крыло"". Давно уже качаем воду насосами и никто не ставит ""козлов"" и не строит из камней ""бральнИц"", для того, чтобы набрать воды, выполоскать бельишко, причалить лодку. Глядя на фото можно еще долго перечислять элементы ушедшей культуры. Эх, вот бы как в детстве, к Митиной заборне или на Володинку за горохом сбегать на колхозное поле",2020-12-08 20:41:58,107,2,1771
1306,"По статистике в группе ""Хламной сарай"" 72 % женщины, и, соответственно, только 28 % мужчины, вот и ретро фотографии чаще встречаются женские. Нашлось очень интересное фото стильных мужчин, наверное памятное изображение сделано на память при посещении малой родины . Узнаёте? Пожалуйста подпишите.",2020-12-07 19:38:16,53,2,1421
1301,Нюхотски робетишки (из архива Кармановой Евгении),2020-12-06 10:10:29,64,1,1467
1299,"Девчата. На первых двух фото, даже приблизительно не знаю, кто на изображении, - надеюсь на вашу помощь. (фото из семейного архива Кармановой Евгении)",2020-12-05 10:38:18,54,1,1456
1297,Нюхотские девчата и жонки,2020-12-04 17:56:16,77,6,2511
1293,"🔉Спорим - тот, кто не пробовал старинную кухню поморов приготовленной в русской печке - до конца своих дней будет верить в рекламу ""вкуснейших"" бургеров и прочую фастфудную смесь.  ⚠А у нас есть приятная новость - мы побывали в старинном поморском селе Нюхча и подготовили фильм - 📺посмотри и запомни какая она - настоящая вкусная и полезная еда🧉! Приятного просмотра!👋    📽Фильм ""Нюхоцкое Сампо""🎞 подготовлен в рамках проекта ""Окно в Поморье"" Победителя Грантового конкурса Фонда Культуры РФ среди проектов реализуемых в рамках XXI Российско-финляндского культурного форума!  #российскийфондкультуры  #аноквартал",2020-12-04 10:26:07,5,1,0
1286,"Нюхча. Середина 50-х прошлого века. У правления колхоза ""Беломор"" девушки и женщины - передовики производства - те, кто ""коня на скаку остановят"". Фото на память. На первом снимке в центре председатель колхоза Поташов Александр Васильевич",2020-12-03 20:06:37,80,2,1712
1285,Нюхча. Рождение лодки. Корабельщики.,2020-12-02 18:23:00,67,2,1341
1271,"Фото поморских жонок. Дорогие подписчики, если узнаете знакомых, просьба добавить информацию.",2020-11-29 13:20:20,64,3,1466
1264,"Вот фото тех поморских девчат - рыбачек на Белом море, чьи лица мелькают в киножурнале. На подледном лове наваги девушки работали наравне с мужчинами, многие уже были награждены медалью «За доблестный труд в Великой Отечественной войне 1941—1945 гг.»",2020-11-28 14:25:07,66,2,1520
1262,"Знакомые лица: О.В. Карельская, Г.И.Докучаева, М.Г.Поташов.",2020-11-27 17:55:19,27,2,657
1252,"Сегодня вот что под руку попало, интересно почитать)))",2020-11-25 20:48:56,30,1,1122
1246,Нюхча,2020-11-24 23:23:12,11,0,0
1232,Нюхчане на промысле в Баренцевом море,2020-11-24 20:40:25,76,0,1497
1230,"Фото тех, кто ждет рыбаков на берегу",2020-11-23 22:41:01,70,1,1469
1228,"На этом снимке нюхчане тоже присутствуют, вдруг фамилия знакомая, пожалуйста, поделитесь информацией",2020-11-22 13:35:32,36,3,1367
1227,"В Нюхче в 1931 г. был организован колхоз ""Беломор"". Колхозных руководителей и бригадиров лова командировали для участия в обучающих курсах, организованных в с. Сорока.",2020-11-20 17:00:01,51,2,1264
1226,"Многие нюхчане получали образование, занимали руководящие должности на флоте.",2020-11-19 19:14:48,41,2,1108
