id,text,date,likes,reposts,views
489,"Пирого́в Мико́ла Іва́нович (13 (25) листопада 1810, Москва — 23 листопада (5 грудня) 1881, Вінниця) — видатний хірург, анатом і педагог. Створив перший атлас топографічної анатомії людини, засновник військово-польової хірургії, започаткував використання анестезії при оперативних втручаннях. Член-кореспондент Петербурзької академії наук, професор, доктор медицини...    Никола́й Ива́нович Пирого́в (13 [25] ноября 1810; Москва — 23 ноября [5 декабря] 1881, с. Вишня (ныне в черте Винницы), Подольская губерния) — известный хирург и анатом, естествоиспытатель и педагог, создатель первого атласа топографической анатомии, основоположник русской военно-полевой хирургии, основатель русской школы анестезии. Тайный советник...",2016-12-18 23:16:34,0,0,0
483,"Летом в Нюхче проходил четвертый Международный литературный фестиваль ""Петроглиф"", от него остались не только воспоминания, стихи, фото, рисунки. В Национальной библиотеке республики Карелия 16 декабря в 16 часов состоится презентация фильма, снятого в Нюхче в рамках этого проекта.Группа поддержки приветствуется. Вход свободный.",2016-12-11 16:12:45,2,0,0
482,Фрагмент почтовой карты Российской Империи 19 века. Московский исторический музей,2016-12-11 15:13:55,7,0,0
476,"Половички с первой заправки остались в музее, а вот уже сняли со станка вторую партию. Вот что натворили две Надежды - Пяткова да Семенова! Правда, только пока полосочки, но как только будем челнок уверенно держать в руках, будем осваивать техники, которым нас научила Татьяна Юшкова. Верим - получится, потому, что редкий день станок простаивает.",2016-11-22 12:12:47,21,0,0
474,Поехали: Хламной сарай – история Карелии в деталях,2016-11-16 10:48:16,8,1,0
471,"Друзья!  В апреле-декабре 2016 г. ПетрГУ (организатор ЛКЭ) проводит традиционный IV открытый региональный конкурс ""Край родной - родное слово (язык, культура, история, ландшафт)"".  Информационное письмо, Положение о конкурсе см. в приложении.  См. информацию для абитуриентов. Прием материалов на конкурс продлен до 15 ноября.",2016-10-28 16:45:39,1,0,0
469,"Не ругайте за Покров, Наношу воды и дров, На отдайте за богатство, А отдайте за любовь! В ЭКЦ ""Хламной сарай"" на Покров фольклорная группа ""Таволга"" провела постановочную свадьбу.Гостей со всех волостей к нам наехало ""свадебить"", все люди званные, долгожданные - фольклорные группы из Сумского посада и Рабочего острова; поклонники и собиратели поморской культуры из Кеми и из Беломорска. Были разыграны сцены: сватовство, пониманье, рукобитье, ""башмаки"", приводной стол. Исполнялись традиционные нюхотские свадебные песни при проведении каждого обряда. Нашлись и ""жених"" да ""невеста"", большущее им за это спасибо! Все участники ""свадебного процесса"" получили массу положительных эмоций!",2016-10-17 13:33:52,18,1,0
466,"О боже,ужасс))  Овод что на 2-ом месте по моему страшней)  Вы как считаете?",2016-10-05 20:02:51,0,0,0
455,"Уважаемые модераторы групп «В Контакте»  и активные жители Поморья!   Сегодня простому читателю довольно трудно найти в интернете полноценную информацию о том, что в настоящее время происходит в поморских деревнях. Текущие события современной деревенской жизни в современных СМИ почти не освещаются, они разрознены, не выходят за рамки деревень и групп «В Контакте». Очень многие интересные, важные события, достойные широкого освещения, остаются неизвестными незарегистрированным в ваших группах читателям.   В связи с этим, предлагаю вам посетить наш новый информационный общественный сайт «Поморская почта», куда вы можете уже сегодня направлять сообщения о важных событиях в вашей деревне, которые вы обсуждаемее в своих группах, давать ссылки на посещение ваших страниц «в Контакте», присылать свои деревенские новости, фотографии деревенской жизни.   Такой сайт востребован временем, и надо сделать так, чтобы он освещал жизнь каждой беломорской деревни, стал общей электронной летописью нынешнего поколения Беломорья. Пусть сайт «Поморская почта» станет объединяющей информационной площадкой для всех неравнодушных к своей малой родине местных жителей, стремящихся рассказать о своих земляках, событиях, о трудностях и радостях, которыми сейчас живёт малая деревня.   Сообщаю также, что недавно рыбакколхоз «Беломор» стал учредителем «Фонда развития поморских деревень», который зарегистрирован в министерстве юстиции. Подробнее о новом фонде, который создан, чтобы помогать развитию поморских деревень Архангельской области, вы можете прочитать на сайте «Поморская почта».   Пишите на электронную почту сайта «Поморская почта», предлагайте свои идеи и предложения по развитию своих деревнь. Так как сайт пока новый, и его структура ещё формируется, ждем от вас замечаний и предложений по развитию и наполнению, и будем рады любой помощи.   А самое главное – ждем от вас писем со статьями, заметками и другими материалами, которые рассказывают о ваших деревнях.  сайт «Поморская Почта», www.pp29.ru    С уважением,  Самойлов Сергей Николаевич, председатель рыбакколхоза «Беломор»",2016-09-09 19:18:00,1,0,0
452,"В ЭКЦ закончились курсы по ткачеству. Татьяна Михайловна много чему научила: и заправлять, и техникам различным, и как снять и оформить готовое изделие. Участницы довольны, теперь подбирают материал для новых изделий.",2016-08-31 17:35:01,10,0,0
448,Участок легендарной Осударевой дороги обнаружен на севере Карелии,2016-08-22 21:27:29,47,11,0
444,"На территории села Нюхча с 6 по 11 августа 2016 г. работала группа ученых по проекту «Осударева дорога». Это 14 экспедиция за 23 года. Цель: найти дорогу, изучить события, которые оставили следы на территории села и района. В составе группы Никулин Сергей Анатольевич, доктор географических наук Потахин Сергей Борисович, спонсор Воронцов Алексей Юрьевич и его сын Владимир, руководит поиском начальник экспедиции - Шелехов Александр Михайлович. Поисковая работа на местности, беседы со старожилами села значительно пополнили собранный ранее огромный материал. 10 августа в ЭКЦ была организована встреча населения с участниками экспедиции.  Неравнодушные к известным историческим событиям жители и гости села ознакомились с описанием маршрута, топонимами «Осударевой дороги», интересными фотоматериалами.  Очень интересная встреча получилась и закончилась по домашнему, за чашкой чая.",2016-08-11 20:42:30,12,1,0
443,"В ЭКЦ мастер Татьяна Юшина из Олонецкого ЭКЦ  проводит для взрослых мастер-классы по ткачеству.  Вчера состоялось первое занятие, учениц пока шесть. На первом занятии Татьяна показывала различные техники, все в предвкушении творческого процесса, всем уже хочется хоть маленький половичок соткать, выстроились в очередь, и ждут следующего занятия с мастером. Большое за то спасибо олончанам!",2016-08-10 11:52:33,13,1,0
441,Четвёртый Международный Литературный Фестиваль «Петроглиф-2016» продолжается! Сегодня его участники прибыли из Нюхчи в Беломорск. Дальнейший путь – по Белому морю на архипелаг Кузова. https://vk.com/belomorskaya_tribuna,2016-07-29 15:26:43,4,0,0
440,"26, 27, 28.07.2016.г. Вв селе Нюхча проходит фестиваль ""Петроглиф 2016"". Гости села проводят различные мероприятия, конкурсы, концерты. На снимках: спа-салон на берегу р. Нюхча; катание на лодках. Организатор, руководитель фестиваля Надежда Сергеевна Семёнова. Фото Сергея Кичангина https://vk.com/club118084942",2016-07-27 16:54:45,5,0,0
438,"Дорогие Нюхчане и гости! Прошу Вас, не проходите мимо проблемы! Поддержите петицию о том чтобы Руководство ОАО "" РЖД "" вернуло продажу билетов до станции Нюхча. Вместе мы сильнее! Пройдите по ссылке и оставьте свою подпись! Спасибо всем большое!  https://www.change.org/p/%D0%BF%D1%80%D0%B5%D0%B7%D0%B8%D0%B4%D0%B5%D0%BD%D1%82-%D0%BE%D0%B0%D0%BE-%D1%80%D0%B6%D0%B4-%D0%B1%D0%B5%D0%BB%D0%BE%D0%B7%D1%91%D1%80%D0%BE%D0%B2-%D0%BE%D0%BB%D0%B5%D0%B3-%D0%B2%D0%B0%D0%BB%D0%B5%D0%BD%D1%82%D0%B8%D0%BD%D0%BE%D0%B2%D0%B8%D1%87-%D0%BE%D0%B0%D0%BE-%D1%80%D0%B6%D0%B4-%D0%B2%D0%B5%D1%80%D0%BD%D0%B8%D1%82%D0%B5-%D0%BF%D1%80%D0%BE%D0%B4%D0%B0%D0%B6%D1%83-%D0%B1%D0%B8%D0%BB%D0%B5%D1%82%D0%BE%D0%B2-%D0%B4%D0%BE-%D1%81%D1%82%D0%B0%D0%BD%D1%86%D0%B8%D0%B8-%D0%BD%D1%8E%D1%85%D1%87%D0%B0-%D0%B1%D0%B5%D0%BB%D0%BE%D0%BC%D0%BE%D1%80%D1%81%D0%BA%D0%BE%D0%B3%D0%BE-%D1%80%D0%B0%D0%B9%D0%BE%D0%BD%D0%B0-%D1%80%D0%B5%D1%81%D0%BF%D1%83%D0%B1%D0%BB%D0%B8%D0%BA%D0%B8-%D0%BA%D0%B0%D1%80%D0%B5%D0%BB%D0%B8%D1%8F?recruiter=179402179&utm_source=petitions_share&utm_medium=copylink",2016-05-26 12:27:45,7,0,0
435,"Здравствуйте уважаемые жители нюхчи, пожалуйста поддержите меня в конкурсе на тему лесные пожары, посмотрев это видео:   https://www.youtube.com/channel/UCvgyNk6cK7rPAVqcomvYtzA  я буду очень благодарен",2016-05-15 13:02:00,0,0,0
433,9 мая 2016. Нюхча - Колпино,2016-05-10 21:26:20,11,0,0
428,"9 Мая, шествие  Бессмертного полка в селе Нюхча.",2016-05-09 18:37:49,104,7,0
427,"Дорогие Нюхчане! Поздравляю всех Вас с праздником Пасхи Христовой! Мира Вам, счастья и Божьей Благодати! ХРИСТОС ВОСКРЕСЕ!!!",2016-05-01 13:35:52,0,0,0
426,"Внимание , дорогие Пинежане!  Мы ждём вас на наших концертах!  Благодарны за репост!))  Справки в л/с http://vk.com/polikarpovaa http://vk.com/zindagi29?w=wall-6010319_2233%2Fall",2016-04-28 00:09:23,0,0,0
422,Нюхотски жонки поздравляют с 80-летием фольклорную группу села Сумский Посад.,2016-04-16 15:00:06,10,0,0
419,"03 апреля 2016 года в городе Кемь прошёл праздник ""Артели поморских берегов"", в котором приняла участие и наша поморская группа ""Иволга"". С большим удовольствием сходила посмотреть на наших девчат))))",2016-04-03 21:56:54,5,0,0
415,Добрый день!Пишу вам с последней надеждой найти брата и сестру!Родилась я в 1960 году в республике Коми ссср дужавский сельский совет ухтинского района это все по паспорту !нас в семье было 4.два брата и две сестры.один брат утонул!брата и сестру мама отдала в интернат помню что она сказала устроимся и потом заберем.я была самая маленькая поэтому мама меня взяла с собой!переехали мы в деревню малашуйка какой город или область я не не знаю!там маму и убил отчим а меня отправили в детский дома г Шенкурс в 10 лет!вот все что я помню на очень хочу найти своих родных и их детей!Спасибо вам!А еще у нас было соседка которая меня хотела удочерить помоему фамилия халтурина мы жили в коттеджах на 2 семьи!А девичья фамилия моя и родных Гришанова!,2016-02-23 15:38:49,0,0,0
410,Северная мода https://vk.com/nordicfashion,2016-01-11 13:22:53,5,0,0
409,"Подпишите Петицию, и расскажите другим! http://www.onlinepetition.ru/viewsigns.php?pUrl=%D0%BD%D0%B0%D1%80%D1%83%D1%88%D0%B5%D0%BD%D0%B8%D0%B5-%D1%81%D1%82--26--%D0%BF--1-%D0%BA%D0%BE%D0%BD%D1%81%D1%82%D0%B8%D1%82%D1%83%D1%86%D0%B8%D0%B8-%D1%80%D0%BE%D1%81%D1%81%D0%B8%D0%B9%D1%81%D0%BA%D0%BE%D0%B9-%D1%84%D0%B5%D0%B4%D0%B5%D1%80%D0%B0%D1%86%D0%B8%D0%B8--%D0%BA%D0%B0%D0%B6%D0%B4%D1%8B%D0%B9-%D0%B2%D0%BF%D1%80%D0%B0%D0%B2%D0%B5-%D0%BE%D0%BF%D1%80%D0%B5%D0%B4%D0%B5%D0%BB%D1%8F%D1%82%D1%8C-%D0%B8-%D1%83%D0%BA%D0%B0%D0%B7%D1%8B%D0%B2%D0%B0%D1%82%D1%8C-%D1%81%D0%B2%D0%BE%D1%8E-%D0%BD%D0%B0%D1%86%D0%B8%D0%BE%D0%BD%D0%B0%D0%BB%D1%8C%D0%BD%D1%83%D1%8E-%D0%BF%D1%80%D0%B8%D0%BD%D0%B0%D0%B4%D0%BB%D0%B5%D0%B6%D0%BD%D0%BE%D1%81%D1%82%D1%8C-",2016-01-08 13:56:31,2,0,0
393,"9 октября школьники Сумского Посада совершили экспедицию в поморское село Нюхча. Это один из самых отдалённых населённых пунктов Беломорского района (Республика Карелия), расположенных на живописном берегу реки Нюхча, впадающей в Белое море.   Первые упоминания о Нюхче можно найти в указах XVI века, согласно которым село было приписано к Соловецкому монастырю, нещадно эксплуатировавшему поморское население: 3 дня в неделю каждый житель должен был отработать на постройке монастыря. В XVIII веке через Нюхчу шёл знаменитый волоковой путь Петра I – «Осударева дорога». До сих пор здесь живёт предание о том, как Пётр I подарил свой кафтан ребёночку, народившемуся в семье, где государь держал ночлег.   Как все поморы, «нюхотски» мужики в прежние времена осваивали просторы северных морей, ловили треску и палтус на Мурмане, держали крепкие торговые связи с норвегами. Нюхчане гордятся своими знаменитыми земляками, купцами, капитанами, рыбаками и мореходами. Один из них - Фёдор Иванович Шамалуев, первый русский тралмейстер.   Сейчас в селе проживает около четырёхсот человек, в школе всего 38 учащихся, есть библиотека, свой дом культуры, фольклорная группа, действует рыболовецкий колхоз «Беломор». Всё больше гостей и туристов привлекает Нюхча созданным недавно этнокультурным центром «Хламной сарай». Надежда Сергеевна Семёнова, исследователь и руководитель центра, гостеприимно встретила участников сумпосадской экспедиции. В ходе экскурсии по селу, школьники узнали историю заселения этих мест, исторические названия частей Нюхчи (Верховье, Посад, Куток, Заручей) и познакомились с северной архитектурой старинных поморских домов. Рассказ о поморских традициях продолжился в музее «Хламной сарай», который силами местных жителей обустроен в старинном доме купца Понамарёва. Школьники узнали много нового и интересного об устройстве поморской избы и повседневной жизни поморской семьи: почему дома поморов располагались окнами на реку, что такое «зымза», «воронец», «красная покрута» и «смотреница». На примере нюхотских старинных домов участники экспедиции убедились как действует поговорка «Дойти до ручки». Представленные в музее орудия лова, рыбного промысла и связанные с ними предметы (промысловая посуда, одежда, приспособления), как нельзя ярко представляют картину жизни и бытования поморов. Закончилась встреча мастер - классом по выпеканию шанежек с картошкой в настоящей русской печи.   Поездка состоялась в рамках программы «Поморский курс» по проекту «Верни былую славу, Сумпосад!», поддержанного Благотворительным фондом Е. и Г.Тимченко и Региональной благотворительной общественной организацией «Архангельский Центр социальных технологий «Гарант». СПАСИБО НАДЕЖДЕ СЕРГЕЕВНЕ ЗА ГОСТЕПРИИМСТВО!",2015-10-12 09:00:59,14,1,0
389,"За Цай и Шаньги картофны спасибо!  Участники музея - мастерской ""Рукоделия Поморья"" благодарят руководителя этнокультурного центра ""Хламной сарай"" (село Нюхча Беломорского района) Семёнову Надежду Сергеевну за гостеприимство, интересные экскурсии, мастер-классы. Мы в долгу не остались и тоже провели 2 мастер-класса по традиционному плетению для школьников села.",2015-09-12 21:02:24,8,0,0
388,"Туристы из Финляндии (Йоэнсу, Хельсинки), в том числе представители общества Друзей России в Финляндии ) отделение в г. Йоэнсу) два дня гостили в селе Нюхча. Хлебосольные хозяюшки Валентина и Лидия угощали гостей рыбниками да ягодниками. Люди, интересующихся традиционной народной культурой  ознакомились с музейной экспозицией этнокультурного центра, архитектурой поморского села, историей Нюхчинского прихода, посетили церковь, поднялись на Святую гору. Вечером состоялась встреча с фольклорной группой ""Таволга"". Поморские песни и танцы, чай и пироги, природа и банька, приятное общение понравилось и гостям и хозяевам.",2015-09-12 10:29:40,13,0,0
386,"20 зуйков из этнокультурного детского лагеря ""Поморские побасенки"" и сотрудники Краеведческого музея из Кеми погостили в нашем музее.",2015-08-26 01:24:55,23,2,0
