id,text,date,likes,reposts,views
980,"Много столетий практически не меняется в поморском укладе способ добычи наваги — рыбы из семейства тресковых. Всё так же выходят жители деревень на прибрежный лёд Белого моря и хитрыми снастями, придуманными невесть когда, да нелёгким трудом зарабатывают свой хлеб.  🐟  Этот небольшой фильм снимался в морозном январе этого года в старинной деревне Колежма, живущей на карельском берегу Белого моря. https://youtu.be/MPPDu8kJ9K8",2019-12-19 16:29:07,8,0,0
956,"Тимофей Рогожин сегодня привозил к нам группу с острова Шпицберген. Северные гости, правда, в другом составе, были в Нюхче три года назад, сказали что приедут ещё.",2019-11-13 23:20:45,55,1,1184
953,"Сегодня в музее ""Хламной сарай"" в рамках школьного проекта, посвященному 75 годовщине Победы, под руководством А. Ф Вещагиной, побывали учащиеся из пос. Вирандозеро. Экскурсия к братской могиле и обелиску, знакомство с солдатскими письмами и книжками, наградными документами, воспоминаниями ветеранов, записанных 35 лет назад, хлебными карточками для мирного населения были познавательными. До приезда родителей на автотранспорте девочки успели соткать пару небольших половичков для кабинета технологии. Осталось время и на выпечку вкуснейших калиток, сами покушали и взяли с собой в качестве гостинчика, чтобы угостить своим творением родных.",2019-10-28 20:08:29,81,1,4089
945,"Скоро минет 75 лет, как закончилась Великая Отечественная война, но люди продолжают скорбить по ушедшим, свято хранят документы, награды, письма. Уже редко, но кто то всё еще ищет своих родных, чудеса хоть и редко, но случаются! К братской могиле в селе Нюхча, где похоронены воины, умершие от ран в 446 эвакогоспитале сегодня приезжали родственники из Баку, навестить своего деда Касымова Энвэра Алакиевича. Внук Энвэр - полный тезка своего деда нашел место захоронения только в 2016 году, и вот, уже второй раз, теперь уже вместе с женой приехали почтить память родного человека. Весной этого года из Мурманска и Вологды приезжали дочери солдата Едренникова Степана Федоровича, захороненного в сентябре 1944 года. Они сказали, что их мечта сбылась, они нашли могилу отца, осталось только сожаление о том, что мама не дожила до этого дня",2019-10-20 00:25:23,40,2,961
942,"Читайте в газете ""Петрозаводский университет"" о нашей кукле -поморке Аннушке и мастерице Анне Житейной (стр. 8) https://petrsu.ru/files/user/e2365a5fa154edeb8fd670f3..",2019-10-18 15:46:57,3,0,0
931,"21 сентября в Беломорске пройдет самое крутое мероприятие осени  ФЕСТИВАЛЬ ПОМОРСКОЙ КУЛЬТУРЫ ""МОРЕ ПОМОР""    ▪Чемпионат мира по ""Поморскому футболу""  ▪Конкурс ""Поморский рыбник""  ▪Бесплатная уха  ▪Ярмарка ремесленников  ▪Мастер-классы и экскурсии  ▪Концерт народных коллективов    И еще много всего интересного. А главное - абсолютно БЕСПЛАТНО!!!!  Бесплатный трансфер из Сумского Посада и Пушного до Фестиваля!!!    Следите за нашими социальными сетями, а так же за информацией в официальных сообществах [club30461892|Центр народного творчества и культурных инициатив], [club185192373|Администрация МО Беломорский муниципальный район], [club41933338|Центр поморской культуры города Беломорска], [club42677022|Районный Дом культуры и кинотеатр], чтобы быть в курсе и не пропустить ничего важного!",2019-09-12 12:06:14,5,0,0
928,"В фондах музея ""Хламной сарай"" хранится такой же токарный винторезный станок для изготовления веретён из березовых заготовок. Даритель Поташов Александр Михайлович, ранее станок принадлежал его деду, Григорию Григорьевичу Поташову",2019-08-29 22:56:26,49,5,970
918,"9 августа в ЭКЦ состоялась встреча жителей и гостей с Ольгой Рубцовой. Оказывается Никола Уккозерский из Кушереки, что хранится в Малых Карелах написан в 1825 году, а образ, хранящийся в Нюхче, появился на Уккозере аж в 1774 году! Узнали много нового, обменялись полезной информацией, помечтали о реставрации нюхотской иконы.",2019-08-10 22:44:49,46,1,918
917,"9 августа ЭКЦ в 17 час  Приглашаем жителей и гостей села на встречу с Ольгой Рубцовой, специалистом по обеспечению сохранности объектов культурного наследия музея «Малые Корелы»    тема ""Редкий образ Николы Уккозрского на иконе 1825 года. Из собрания музея музея ""Малые Корелы"".",2019-08-07 10:53:02,9,1,545
916,Дождило весь день во вторник. Больше фоток выставил у себя на странице в Фейсбуке.,2019-08-02 18:26:30,5,0,0
911,"В этноцентре ""Хламной сарай"" с 29 по 31 августа побывали представители общественной организации ""Друзья Кинермы"" из Оулу. Погодка наша напомнила всем, что мы живем на Севере, НО!!! За теплый прием мы получили приятный отзыв от гостей: - ""Мы попали в поморскую сказку!""",2019-07-31 12:35:28,53,0,897
909,"В гостях у филологов - Надежда Сергеевна Семенова, руководитель этнокультурного центра ""Хламной сарай"" села Нюхча Беломорского района. Несколько лет работы связывают Лабораторию лингвистического краеведения со старинным поморским селом. Принимаем Надежду Сергеевну в состав лаборатории! Появились новые идеи. Надеемся, наши мечты сбудутся.  На фото: Н. С. Семенова, И.А. Кюршунова, Е.Р. Гусева - на экскурсии по Гуманитарному парку. Петрозаводского государственного университета https://vk.com/public177297089",2019-07-25 10:28:30,5,0,0
905,"Отряд ПетрГУ ведет исследовательскую работу в ""Хламном сарае"" в деревне Нюхча :: Петрозаводский госу",2019-07-15 17:49:53,3,0,0
898,"Прощаемся на дорожку, делаем фото на память. Многие из них обещали вернуться в следующем году, а может быть, даже осенью. С описанием фондов перебрались на второй этаж, осталось еще немало интересного! Появились желающие писать курсовую по истории села, что оооочень радует! Спасибо вам, светлые, умные головушки!",2019-07-08 15:19:57,42,0,943
894,"Вот он какой, Никола Уккозерский!",2019-07-06 01:22:01,10,0,490
893,"Работаем ударно! Историки продуктивно описывают фонды ""Хламного сарая"", филологи беседуют с информантами, охотятся за диалектными словами, топонимами и кличками животных. Вчера произошла историческая встреча с представителями местного населения. Преподаватели и студенты познакомили слушателей с целями и задачами комплексной экспедиции ПетрГУ, рассказали об университете, некоторых его научных направлениях, выступили с популярными сообщениями о специфике собираемого материала, ответили на вопросы аудитории. Руководитель этноцентра Н.С. Семенова провела обзорную экскурсию по селу для двух экспедиционных отрядов, рассказала об истории села, своеобразии его архитектуры, материальной и духовной культуре нюхчан.",2019-07-06 01:12:32,90,7,5466
892,"Уважаемые жители и гости села!  В селе Нюхча работает экспедиция Петрозаводского государственного университета.  Участники экспедиции приглашают вас на встречи, посвященные:  04.07. 1. Петр ГУ и поступление в институты филологии и истории, политических и социальных наук,  2. Внеучебная деятельность в Петр ГУ    05.07. – научно-популярные лекции от руководителя экспедиции, доктора филологических наук И.А. Кюршуновой и кандидата филологических наук Е.Н. Варниковой    Встречи состоятся в Этноцентре в 17.00 час",2019-07-04 00:31:15,39,3,1041
888,Нюхотская послевоенная школа. Анна Федоровна Кичигина со своими учениками,2019-06-21 22:42:21,44,0,894
885,"И вот бригада прекрасных парней- строителей колокольни в Нюхче ! Фамилии чуть позже... Но бригадир, Андрюша Киселёв, строитель- создатель и церкви нашей и колокольни ( стоит второй слева) , заслуживает особого уважения ! И за Храм Божий , и за колокольню, и за самоотдачу ! Дай Бог ему всего-всего !",2019-06-11 19:43:46,14,1,0
880,"Сегодня дружно, большими стаями летели лебеди, наверное сегодня их, ""лебединый день""",2019-05-28 22:55:33,46,0,871
872,"3 мая у Беломорского филиала генеалогического общества Карелии наконец то сбылась мечта побывать в ЭКЦ ""Хламной сарай"". Капризная майская погода ""выполнила"" все наши просьбы и приветливо встретила солнышком, - а как же, гости впервые в Нюхче!. Увлекательные экскурсии, горячий обед из русской печи, мастер-классы по ткачеству и выпеканию шанёг, познавательная встреча с жителями села по составлению родословного дерева пролетели в один короткий миг. Спасибо Елене Ивановой за организацию поездки, приезжайте ещё!.",2019-05-04 14:12:24,66,5,1374
870,"3 мая в 16.30 ЭКЦ Беломорский филиал генеалогического общества Карелии приглашает жителей и гостей села Нюхча на встречу. Тема: ""Моя родословная"".  У вас будет возможность получить консультации по составлению своей родословной.",2019-04-28 11:17:52,11,1,584
868,"Сегодня у нас в гостях карельский кулинар, блогер Насто. Она ездит по городам и селам, забирается в глубинку в поисках старых рецептов. Гостья осталась в восторге от нюхотской природы, хлеба из местной пекарни, блюд поморской кухни из русской печи и красивого солнечного заката.",2019-04-24 20:52:33,52,2,1013
859,"Продолжаем собирать РЕЦЕПТЫ ПОМОРСКОЙ КУХНИ  Давайте, все вместе восстановим, вспомним и сохраним рецепты поморской кухни как часть поморской культуры. Участвуйте в конкурсе, пишите рецепты, пробуйте приготовить поморские блюда, делитесь впечатлениями. И сделайте, пожалуйста, репост этой записи. Ссылка на условия конкурса https://vk.com/pomormagaz?w=wall-161346942_114  #Поморьска_магазея@pomormagaz",2019-04-03 18:34:38,1,0,0
858,"Несколько экземпляров своей книги ""Приходило море в гости"" автор подарил в ЭКЦ ""Хламной сарай"", желающие могут взять для чтения.",2019-03-29 23:49:43,7,1,448
851,"""Дайте муцьки, да дайте маслиця, сковороды, да сковородницька! Вода в пеци, буду блины пекци!"" Друзья, всех с прокатной Масленницей!",2019-03-09 21:05:33,8,0,0
849,"100 лет назад в селе Нюхча произошла кровавая трагедия. В начале 1919 года сюда прибыл отряд белогвардейцев и англичан. Они объявили набор в ""Добровольческий славяно-британский легион"". Нюхотские большевики повели борьбу против этого призыва. По их советам нюхчане призывного возраста уходили в леса, на рыбные тони, на Онегу к красным. Крестьяне уводили в леса лошадей. В Нюхче начались аресты, в числе первых были схвачены члены местной ячейки РКП(б). Глухой ночью 27 февраля 1919 года шестеро арестованных большевиков - И.В.Попов, Е.Г.Шумилов, С.А.Божик, И.В.Титов, В.Ф.Кичигин, А.И.Воронин вышли в скорбный путь под конвоем палачей. В четырех верстах от Нюхчи по Онежскому тракту их остановили. Белогвардейский офицер объявил приказ главнокомандующего союзными войсками генерала Пуля о смертной казни шестерых крестьян ""за смутьянство и противодействие властям"" Раненые И.В.Титов и В.Ф.Кичигин убежали в лес. А.И.Воронин очнулся, когда его зарывали вместе с убитыми, но не выдал ничем, что он ещё жив. После ухода белогвардейцев он выбрался из под земли и к утру с трудом вернулся домой. Е.Г.Шумилов, С.А.Божик и первый председатель местного совета И.В.Попов покоятся нынче в братской могиле в центре Нюхчи, на высоком берегу реки.",2019-02-26 23:59:30,7,0,0
847,"Про суровЫх, неуёмных, хулиганов, нечистых на руку старики в Нюхче говорили: ""Тот еще ушкуй!"" Вот они какие были, ушкуи!",2019-02-20 15:15:59,8,0,372
840,Давайте все вместе не дадим закрыть нашу школу и не умереть селу!!!! Мы сможем не дать экономить на наших детях !!! Наше село и школа будет жить!!!! ПОДПИШИТЕ  ПЕТИЦИЮ!!!!! http://chng.it/pgbcFKWP,2019-01-12 19:11:44,6,0,0
830,https://vk.com/album158450878_255190327 Прекрасная работа Николая Телегина !,2018-12-09 06:34:32,2,0,0
828,"Нюхча  Ой, ты, реченька - голубушка, Речка - девочка, подросточек, Скачешь с камешка на камешек Белой ночью к морю Белому  ЗолотА водица звонкая Раскатилась по порожекам - Что ты шепчешь под окошком мне, Под черёмуховым берегом?  Я сожму в ладони камушек - Влажный круглый чёрно-крапчатый: До свидания, душа моя,  Речка Нюхча, северяночка.  Я схожу ещё на бережок, Я скажу тебе тихонько там: Уплывай - не тай в душе моей, Нюхча, реченька - лебёдушка...  Автор стихов Юлия Мусалимова, победитель IV Международного литературного фестиваля ""Петроглиф 2016"",Санкт-Петербург,",2018-12-05 19:29:02,9,0,0
827,"прекрасное предложение для тех, кто хочет научиться ремеслу и впоследствии шить суда",2018-12-04 19:38:25,0,0,375
823,"Друзья, можно посмотреть прямую трансляцию",2018-11-30 18:34:02,1,0,328
817,"В чем смысл моей жизни? Зачем я здесь?  ГЛАВНЫЕ ВОПРОСЫ ЧЕЛОВЕКА  Анастасия: Некоторые читатели спрашивают: «А в чём смысл моей жизни? Зачем я здесь? Неужто только чтобы посадить дерево, построить дом и вырастить детей?» И сами же в своих размышлениях отвечают, что если это были бы основные цели существования человека на земле, то, во-первых, ему не нужно было бы столь сложное строение материи, в том числе такая «сверхизбыточная» организация мозга, включающая в себя различные уровни состояния сознания. Во-вторых, логично предположить, что все, кто уже имеют дом, детей и личный сад, были бы счастливы и удовлетворены своей жизнью. Но ведь в основном эти люди и задают такие извечные вопросы, не найдя удовлетворения в реализации желаний своей молодости.    Ригден: Смысл человеческой жизни вовсе не в размножении и благоустройстве — это всего лишь естественные инстинкты любого животного, которое генетически запрограммировано сотворить себе нору, гнездо и так далее для того, чтобы вырастить потомство. Человек — это больше чем животное, его смысл — стать духовным бессмертным существом.   — из книги Анастасии Новых, АллатРа  читать онлайн https://allatra.tv/category/knigi-anastasii-novykh  передачи на АЛЛАТРА ТВ: https://allatra.tv/programs-with-im",2018-11-17 20:27:44,2,0,0
815,"здравствуйте! на днях сделал небольшой фильм про путешествие по необитаемым островам Белого моря карельской стороны. восемь дней я и дюжина туристов со всех концов России на настоящем поморском карбасе проходя от острова к острову наслаждались неподдельными эмоциями от того что видели и от того что делали — ловили навагу на простейшую снасть, собирали «морскую капусту» и морошку, ели блюда поморской кухни из этого всего и сходили с ума от невероятных закатов, приливов-отливов, белых ночей, и невероятных видов. https://youtu.be/zl1QBg82vCs",2018-11-16 18:08:41,0,0,0
807,"Вчера в Нюхче побывал клуб ""Наша Арктика"". Ребята посетили Святую гору, прошли с обзорной экскурсией по улицам села, затем в этноцентре ""Хламной сарай"" состоялась встреча с жителями. Гости, можно сказать поразили нюхчан своими глубокими знаниями истории и природы Онежского залива. Андрей Салин рассказал о Белом море с такой любовью, что у нас появилось ощущение, что он знает здесь каждый кустик и каждый камушек. Участники встречи посмотрели прекрасный фильм "" Острова жизни"", который был снят в Белом море во время экспедиций. Благодаря Сергею Салину и Илье Демченко в Нюхче теперь есть арт-объект! Молодые художники на стене хлебопекарни изобразили тюленя. Время пролетело очень быстро, но гости успели оценить вкус горячего местного хлеба; картошки, запеченной в русской печи; копченой трески и палтуса, которые производят в колхозе ""Беломор"". От имени жителей села хочется выразить огромную благодарность организаторам и участникам клуба за воспитание любви к Родине! Приезжайте еще!",2018-11-01 23:06:57,8,0,0
804,30 октября - День памяти жертв политических репрессий в России.,2018-10-30 13:07:20,1,0,0
