id,text,date,likes,reposts,views
315,"Аудиобиблия на северо-карельском (не знаю, было ли уже это в группе и нужно ли; ничего не могу сказать про качество, ибо языком не владею):  Вместе с текстом (для аудио - нажать на кнопку ""плей"") http://www.bible.is/KRLIBT/Matt/1  В виде радио: http://www.bible.is/radio/KRLIBTN1DA  Ссылка на радио для аудио-плеера: http://radio.bible.is:8000/KRLIBTN1DA  У них же где-то наверняка есть способ слушать это через мобильные приложения.",2016-08-17 16:42:13,4,0,0
313,"Аудиобиблия на северо-карельском (не знаю, было ли уже это в группе и нужно ли; ничего не могу сказать про качество, ибо языком не владею):  Вместе с текстом (для аудио - нажать на кнопку ""плей"") http://www.bible.is/KRLIBT/Matt/1  В виде радио: http://www.bible.is/radio/KRLIBTN1DA  Ссылка на радио для аудио-плеера: http://radio.bible.is:8000/KRLIBTN1DA  У них же где-то наверняка есть способ слушать это через мобильные приложения.",2016-08-16 23:29:19,2,0,0
304,Huomnešt’äht’i - Saamil’äkši (C) 0049 - оргалит – масло 40 Х 40  Perinteiset suomalais-ugrilaisten symboleja. Sami aamutähtenä / Саамская утренняя звезда. Традиционные символы финно-угорских народов.,2016-07-29 16:29:18,4,0,0
303,друзья помогите пожалуйста с переводом следующих слов  каски  ситта  акка  вехти  сярки  пюхта  заранее благодарю;) я сейчас в карелии на ладоге и хочу на ближайших островах оставить таблички с их названиями) те слова и есть первые пол слова второе саари - это остров я так понимаю,2016-07-29 16:11:37,0,0,0
300,Hello ladies and gentlemen!!! My name is Svetlana! I'm a native speaker of Russian language. I teach Russian as foreign. Do you want to learn Russian? Do you need any help? I'm here!!! I'm with you!!!,2016-06-20 11:53:30,0,0,0
297,"Приветствую всех!!! Я только начинаю узнавать про свои корни, Хотелось бы узнать про национальные костюмы( нигде не могу найти информацию) - узоры вышивки, если вообще есть такое!!! Буду благодарна!!!",2016-06-07 15:25:52,4,0,0
296,"Где в Карелии можно услышать карельский и познакомится с карельским бытом? Дублируются ли в Карелии объявления на карельский? Еду туда в конце июня, регион, помимо природных красот интересен в культурном плане.",2016-06-06 08:40:05,2,0,0
294,"Добрый день!😊 Подскажите, пожалуйста, это дословный перевод? Hongikot dai kivimägyöt -Эта сказка скал и сосен Если нет, то как правильно перевести эту русскую фразу на карельский? Также буду очень благодарна за транскрипцию))😇",2016-05-31 16:11:52,1,0,0
291,Буду очень благодарен за подписку в Инстаграм!  #учимкарельскийязык Karjalan_kieli Спама НЕТ!),2016-05-27 10:23:33,2,0,0
288,Добрый день подскажите есть аудио разговорник?,2016-05-20 09:44:22,0,0,0
285,"Всем тем, кому интересен карельский язык!  Появился текст и перевод песни ушедшего от нас карельского музыканта Лео Севеца ""Älä muamo čakkua"" - ""Не ругай, мама"". Перенесла текст на бумагу и выполнила перевод Татьяна Баранова.   Лео Севец был музыкантом-оркестром.  Он виртуозно играл на многих народных инструментах - струнное кантеле, йоухикко, гитара. Был участником народных ансамблей ""Toive"", ""Кантеле"" и вокалистом легендарной карельской группы ""Myllarit"". Всей своей душой глубоко чувствовал народную музыку. Инструмент в его руках не играл - разговаривал. Лео исполнял народные песни на финском, карельском и русском языках. Нажав на название песни, Вам откроется его текст и перевод.",2016-05-05 19:13:35,14,0,0
276,На портал Fenno-Ugrica в свободный доступ выложены газеты на карельском языке:  Олонецкая звезда (1919) https://fennougrica.kansalliskirjasto.fi/handle/10024/87245 Kolhozoin puoleh (1931-1933) https://fennougrica.kansalliskirjasto.fi/handle/10024/88344 На колхозной стройке (1936) https://fennougrica.kansalliskirjasto.fi/handle/10024/87281 Karielan toƶi (1937-1939) https://fennougrica.kansalliskirjasto.fi/handle/10024/87267  Особенно они будут интересны всем интересующимся тверским диалектом карельского языка.,2016-05-03 15:43:02,5,0,0
273,"у меня бабушка карелка из Прионежского района - знает частушки, которые я на быстрый поиск не вижу в записях. А еще она умеет ""плакидать"" - оплакивать умерших. Может кто занимается частушками, или этим жанром, им нужны парочка для материала? Не долог срок остался тому поколению.",2016-04-26 15:13:02,3,0,0
268,Страницы из газеты Kolhozoin Puleh. Материал предоставила Марина Занина.,2016-04-25 22:23:22,15,1,0
258,"Здравствуйте.как по карельски называются валенки .9 букв.4 буква Т,,,,",2016-04-19 20:56:45,0,0,0
249,Скажите а есть аудио учебник карельского?,2016-03-21 16:42:05,2,0,0
247,"Люди помогите мне пожалуйста! Я ученик 11 класса мне 17 и не знаю своего родного языка(карельского). Кому не трудно напишите в комментарии какие нибудь стихи в 3 видах(на карельском перевод и как читается). Очень вас прошу например вот так:  "" Сегодня встану я с рассветом,  И босиком пойду к реке,  И напишу стихи об этом  Вам, на карельском языке... ""  Tänäpäi nouzen ylen aijoi I kengättäh lähten (evele?) I kirjutan ruon, kui midä oli Karjalan kielel sinule  Танапяй новзен улен айгой, И кенгамхтах ляхтен евеле, И кирьютан руон,куй мида оди, Карьялан киалел синуле....",2016-03-11 22:46:44,7,0,0
242,"Рекорд скачиваний в Fenno-Ugrica! Только за январь 2016 года пользователями было произведено 55 000 скачиваний различных материалов, в основном, за счет российских пользователей из различных, больших и не очень, финно-угорских районов и областей.  Благодарим всех наших пользователей за интерес к проекту!  Новые поступления газет на удмуртском и коми языке можно просмотреть здесь: https://fennougrica.kansalliskirjasto.fi/browse?type=dateaccessioned  #финноугры #коренныенароды",2016-02-01 13:27:40,1,0,0
241,"Доброго времени суток! Ищу человека, который способен рассказать об основах карельского языка, т.к. в интернете должной информации не нахожу. Свяжусь в ЛС, заранее спасибо.",2016-01-30 22:08:11,1,0,0
237,Новые поступления на портале Uralica! В коллекцию были добавлены ссылки на оцифрованную в Тверской областной библиотеке газету Karielan Sana на тверском диалекте карельского языка за 1996-1997. Ознакомиться с номерами газеты можно по ссылке: http://uralica.kansalliskirjasto.fi/Search/Results?lo..     Search Results - Karielan Sana - Uralica uralica.kansalliskirjasto.fi,2016-01-20 17:02:16,3,0,0
236,"Я родилась на Севере Карелии в Тикше,бывший Ругозерский,потом Сегежский,теперь Муезерский район.В семье Карельской,до 6 лет не знала русского языка ,пока не пошла в школу.Но к сожалению забыла Карельский язык,но всё равно какая-то ностальгия есть.Теперь живя в Финляндии говорю на финском,но услышав карельское слово и разговор,душа радуется.Поэтому с удовольствием буду вспоминать свой язык.",2016-01-20 09:32:08,7,0,0
235,"Внимание! Событие нового 2016 года! В сети появились записи Белого Танца на карельском языке! - Карельская полька ""Тулэ-Тулэ"" (перевод Аркадия Токарева) и легендарный вальс ""Белый танец"" (перевод Татьяны Барановой) Звукозапись: Григорий Зимин Автор проекта: Ольга Гоккоева  Приятного прослушивания! Надеемся, мы вас порадуем и приятно удивим необычным звучанием :)  #белыйтанец #карельскийязык #петрозаводск #творческаясемья #виа #семья",2016-01-12 00:42:25,11,0,0
232,Поговорки,2016-01-05 20:24:52,6,1,0
231,Друзья! С наступающим Новым годом! Желаем вам в новом году всех земных благ и успехов в изучении языка!),2015-12-31 14:51:13,12,0,0
227,"Прошу прощения за беспокойство. Мои предки, жившие в районе Суходолья, в ранних метрических книгах (17-18 века) записаны с фамилией Mackara. В последствие стали писаться Makkara, что в переводе с финского ""колбаса"". Может быть первоначальное написание фамилии имеет карельские корни? Или всё-таки так колбаса преобразовалась? 😉 Спасибо.",2015-12-08 14:36:38,0,0,0
214,"Сказка ""Курочка ряба"", на Карельском Русскими буквами.",2015-11-22 18:21:42,13,3,0
213,Сборник стихов С.В. Тарасов.  На Карельском языке,2015-11-22 11:25:06,6,1,0
209,"Скажите пожалуйста , если аудиозаписи произношение букв в Карельском языке ?",2015-11-14 04:00:36,0,0,0
208,Мои первые 100 слов по-Карельски (Тверской говор),2015-11-12 18:03:33,27,8,0
200,"https://play.google.com/store/apps/details?id=hitech.dictionary2 для тех кто не понимает что в этой группе пишут но хочет понять, бесплатно в play market  для android ( Это я так понЯл тестовая версия есть глюки, и кстати есть такойже только русско-карельский)",2015-10-05 20:56:27,2,0,0
197,"Вся моя родня из тверских карел . Две прабабки в разговоре со мной переходили на карельский  . Я знаю очень мало слов , жалею что не пыталась учить язык.  Помню слово ""мидя""  - что надо . Ховка -собака . Кен он -кто он ? Ну и ещё несколько слов.",2015-09-18 22:56:00,3,0,0
187,"Танапяй новзен улен айгой, И кенгамхтах ляхтен евеле, И кирьютан руон,куй мида оди, Карьялан киалел синуле....",2015-08-21 13:01:18,5,0,0
186,"Добрый день, друзья. Не подскажете ли, как на карельском будет слово ""черника""? Заранее спасибо.",2015-08-20 12:54:05,3,0,0
182,"- Mi siula on armas azie? - Muate. - Miksi? Oletko sie laiska? - Mie tykkyän muata vain en sentäh jotta olen laiska. Miulla miellyttäy muate sentäh jotta sielä, missa on uni, on toini muailma. Sielä on starina. Tuo starina, kumpani on sopiva vain siuta varten. Kumpani miellyttäy vain siulla. Sielä sie voit armastua, uneksie, elyä kun tahot... Ymmärätkö? Uni on parempi,parempi mitä elämä.   - Какое твое любимое занятие? - Спать. - Почему? Ты ленивый? - Я люблю спать не потому что я ленивый. Мне нравится спать потому что там, где сон - там другой мир. Там сказка.Та сказка, которая подходит только для тебя. Которая нравится только тебе. Там ты можешь любить, мечтать, жить так, как ты хочешь... Понимаешь? Сон лучше, лучше чем жизнь.  Собственно-карельское наречие.",2015-08-04 22:31:55,22,4,0
180,"Muuzikkassa on elämä!  Muuzikka antau hyvämieli! Kuntele muuzikkua, tanssi, laula! Elä! Kaikkilla hyvyä kesyä)",2015-07-28 17:13:58,19,3,0
178,"Стоит ли развивать группу, выкладывать новые слова и фразы?",2015-07-28 16:45:12,6,0,0
176,"Terveh! Minulla on kysymys...есть ли на Карельском языке слово ""Мушня"" и что бы оно могло означать. Спасибо заранее.",2015-07-28 02:49:24,2,0,0
174,"Дорогие друзья! К сожалению, наша группа застряла на одном месте. В следствии чего у администрации появилось предложение ко всем участникам и желающим выучить карельский язык. Мы предлагаем вам выразить свои пожелания о том, слова какой темы вы бы хотели узнать в нашей группе, какие фразы вам интересны на карельском языке и прочее. Свои предложения можете писать в комментарии или в личку администраторам. Мы постараемся учесть каждое мнение и подготовить подборку слов и фраз по вашему желанию. После того как темы будут опубликованы, мы сможем попробовать создать диалоги соответствующей направленности, поговорить на карельском языке, тем самым закрепив полученные знания.  Ждем ваших предложений! С уважением, администрация группы ""Учим Карельский язык""",2015-07-27 18:57:14,7,0,0
168,Разговор за столом ( на карельском ) https://cloud.mail.ru/public/HNSv/5N8o24tC4,2015-07-14 13:38:16,3,0,0
163,Терви-привет.А как пока?,2015-06-24 00:12:37,0,0,0
161,"На портале Uralica теперь доступны аудиозаписи на тверском диалекте карельского языка Тверской областной универсальной научной библиотеки, а также хантыйская газета ""Лух авт"" и несколько книг на хантыйском языке. Подробности читайте в нашем блоге:  http://blogs.helsinki.fi/fennougrica/2015/06/22/khant..",2015-06-23 10:55:23,0,0,0
153,"Фразы, с переводом на Карельский язык (русскими буквами). Выпуск 3. Источник словарь Пунжиной.",2015-05-14 14:52:39,10,1,0
149,Киньте  хороший словарь что бы легко и быстро научиться и алфавит если можно,2015-05-12 16:10:10,0,0,0
136,Привет. Меня зовут Татьяна. Хотела бы приобрести русско-карельский разговорник автора Галины Леттиевой. Не могли бы вы мне помочь в этом.,2015-03-25 16:40:38,1,1,0
131,Подскажите пожалуйста! Где можно купить/заказать русско-карельский разговорник?,2015-03-20 21:09:43,0,0,0
123,"Подскажите пожалуйста, как на карельском будет : ""Медвежья шкура""?",2015-03-05 17:46:31,0,0,0
121,как будет на карельском пингвины.,2015-03-02 15:49:39,0,0,0
119,Värit-Цвета.  Valkie-Белый. Musta-Черный. Sinini-Синий. Kahvivärini-Коричневый. Keltani-Желтый. Sireeni-Сиреневый. Vihrie-Зеленый. Oranssi-Оранжевый. Harmua-Серый. Pruuni-Бордовый. Fioletti-Фиолетовый. Vualiensinini-Голубой. Ruskie-Красный. Vualienruskie-Розовый. Kullanvärini-Золотистый. Hopienvärini-Серебристый.,2015-02-24 22:33:01,20,5,0
110,"Всем доброй ночи, посоветуйте, пожалуйста, всё-таки какой лучше диалект карельского языка начинать изучать с нуля, на каком чаще разговаривают. Я из Мурманской области, книг по карельскому языку в моём городе вообще никаких нет, поэтому буду благодарен, если подскажите пособия, которые лучше всего подойдут для начального изучения.",2015-01-29 23:53:30,0,0,0
109,"Tänäpiänä myö pakajamma ajasta )  Секунда-sekunti Минута-minuutti Час-tunti Полчаса -puoli tuntie Два часа-kaksi tuntie Утро-huomenes День-päivä Вечер-ilta Ночь-yö Утром-huomeneksella Днем-päivällä Вечером-illalla      -yöllä Вчера-eklein Сегодня-tänäpiänä Завтра-huomena Послезавтра-ylihuomena Позавчера-toissapiänä Завтра вечером-huomena illalla Рано-aikaseh Поздно-myöhäh Пораньше-aikasempah Попозже-myöhemmin,myöhempäh  Фразы)  Сколько время?-mitä kello on?'Kuin äijän kello on? Шесть часов-kello on kuusi  Половина деcятого-kello on puoli kymmenen Пять минут пятого-kello on viisi minuuttie viijetta Пятнадцать минут одиннадцатого -kello on viisitoista minuuttie yhettätoista  Двадцать пять минут четвертого-kello on kaksikymmentäviisi minuuttie nellättä Двадцать минут второго-kello on kaksikymmentä minuuttie toista Десять минут восьмого-kello on kymmennen minuuttie kaheksatta Тридцать пять минут десятого-kello on kolmekymmentäviisi minuuttie kymmentä  Без десяти третьего-kello on kymmentä minuuttie vaila kolmie  Без двадцати пяти минут двенадцатого-kello on kahtakymmentä minuuttie vaila kähtätoista Без пятнадцати минут четвертого-kello on viittätoista minuuttie vaila nellyä",2015-01-25 18:37:30,19,3,0
