id,text,date,likes,reposts,views
103,"Предлагаю обсудить данный докемент  , при необходимости подправить и дополнить , а также присоедениться к его поддержки. Главе Республики Карелия Господину Худилайнену Александру Петровичу Обращение Уважаемый Александр Петрович, Мы, этнические карелы, проживающие как на территории Республики Карелия так и за ее пределами, сильно обеспокоены тем, что количество этнических карел проживающих в Карелии за последние несколько десятилетий сильно сократилось и продолжает сокращаться. Также беспокойство вызывает тот факт, что количество карел носителей языка среди карельского населения республики также сокращается из года в год.  Одну из причин такого уменьшения численности карел в целом и карел говорящих на родном языке мы видим в том что вся система образования в республике построена на русском языке, начиная с дошкольной программы и заканчивая высшими учебными заведениями, что с одной стороны способствует продвижению русского языка, но с другой стороны вытесняет карельский язык из быта карел как нации. Между тем хотели бы обратить ваше внимание на то, что согласно конституции Карелии, этническим карелам проживающим на территории Карелии гарантированы определенные права, в частности: • Глава 1 Статья 1 Пункт 5 - Исторические и национальные особенности Республики Карелия определяются проживанием на ее территории карелов. • Глава 1 Статья 11 Пункт 2 - В Республике Карелия народам, проживающим на ее территории, гарантируется право на сохранение родного языка, создание условий для его изучения и развития. Также хотим обратить ваше внимание на то, что в 2009 году в республике Карелия была утверждена программа развития карельского языка до 2020 года.  Нас очень радует наличие следующего пункта среди различных мероприятий в данной программе, например, пункт 1.5:Разработка и принятие необходимой нормативной правовой и научно-методической базы государственных образовательных стандартов в области карельского языка с сопровождающим их пакетом документов (программы, учебно-методические комплексы и др.) для внедрения в систему образования Республики Карелия), но вызывает беспокойство что до сих пор ничего конкретного по этой программе сделано не было.   В связи со всем вышесказанным, мы просим вас поручить Министерству Образования Карелии до начала учебного года 2016-2017 разработать программу обучения для детсадовской и школьной программ для начальных классов НА КАРЕЛЬСКОМ ЯЗЫКЕ и внедрить ее в существующую систему дошкольного и школьного образования на территории Карелии к упомянутому нами году. Мы считаем, что обучения русскому языку как государственному языку республики как части этой программы, будет достаточно для того чтобы обеспечить достаточный уровень знания государственного языка РК и РФ для карельских детей, чтобы они могли в дальнейшем оставаться полноценными членами общестава, при этом свободно владея и родным языком. Мы верим, что если детям дошкольного и школьного возраста представляющим на территории Карелии карельский этнос будет предоставлена возможность обучаться на карельском языке в местах их компактного проживания по дошкольной и школьной программам, то это очень поможет сохранить и в дальнейшем развивать карельский язык и карельскую культуру как на территории Карелии так и за ее пределами. Искренне надеемся на ваше понимание сложившейся ситуации и помощь в данном вопросе. С уважением, Представители карельской общественности",2015-01-23 18:15:23,15,0,0
102,"Поговорим о погоде) Pakajamma ilmasta)  Прекрасная погода-Kaunis ilma. Солнце-Päiväni, aurinko. Туман-Sumu. Молния сверкает-Tulta isköy. Жарко-On kuuma siä, on äkie. Дождь идет-Satau vettä, vihmuu. Дождливая погода-Vihmani ilma,vihmasiä. Плохая погода-Paha siä. Пурга\\вьюга-Purku,pyry. Метель-Tuisku. Зонтик-Sontikka,vihmasuoja,sajevarjo. Видимость-Näkyvyys. Облачно-On pilvini siä, taivas on pilvissä. Снег идет-Satau lunta. Град идет-Ruahta satau. Будет гроза-Ukkosenilma tulou. Грозовая туча прошла мимо-Ukkosenpilvi mäni kylicci. Морозно-On pakkani. Морозит-Pakkaistau.  Ну и несколько фразочек)) Какая там погода сегодня?-Mimmoni sielä siä on tänäpiänä? Холодно сегодня-Tänäpiänä on kylmä ilma (on vilu) Ветер сильный дует-Lujasti tuulou. Какую погоду завтра обещают?-Mommoista siätä luvatah huomiseksi? Завтра будет дождь-Huomena satau  vihmuu ...тепло-on lämmin ...сильный мороз-on luja pakkani. 18 градусов мороза-Kaheksantoista astetta pakkaista.",2015-01-23 18:05:17,41,13,0
99,"Смотрите,вслушивайтесь)Будет полезно тем,кто изучает карельский!)",2015-01-21 19:41:36,61,21,0
97,"Небольшая подборка самых разных фраз и выражений. Наречие собственно-карельское, если где какие ошибки-не стесняясь исправляйте))  Ничего особенного-Ei mitänä erikoista. Как поживаешь-Kuinpa sie elät? Спасибо,все в порядке-Passipo,kaikki on kunnossa . По-прежнему-Entiselläh. Всего хорошего-Kaikkie hyvyä. Заходи еще-Tule toicci. Разрешите познакомиться-Suanko tuttavustuo? Приятно познакомиться-Mukava tuttavustuo. Я жду-Mie vuotan. Конечно-Tietysti. Приходите в гости-Tulkua gostih. Позвони (напиши) мне-Soita ( kirjuta )  miula Позвоню(напишу)-Soitan (kirjutan) Что ты сказал?-Mitä sie sanoit? О чем ты думаешь?-Mistä sie ajattelet? Откуда ты пришел?-Mista sie tulit? Что Вы хотите(хотели)?-Mitä työ haluotta(halusitta)? Сколько время?-Mitä kello on?Äijänkö kello on? Откуда я знаю?-Mistä mie tiijän? Откуда ты знаешь?-Mistä sie tiijät?",2015-01-20 20:43:55,12,0,0
95,Русско-Карельский разговорник (собственно-карельском наречии карельского языка),2015-01-16 15:36:03,9,5,0
93,"Повесть ""Кузмич"" (на карельском, Тверской говор) http://docs.tverlib.ru/inlit/kuzmich.pdf",2015-01-15 23:11:12,3,0,0
90,"ОБРАЗЦЫ КАРЕЛЬСКОЙ РЕЧИ (записано в с. Святозеро от информанта 1930 г. р., ур. д. Вашаково)",2015-01-15 09:47:00,4,1,0
86,"Мать моя тверская карелка, из пос. Калашниково (деревни бабушки и деда Б.Плоское и Пурышево) Лихославльского р-на Тверской (Калининской) обл. В раннем детстве я жил у бабушки, она говорила только на карельском - и я понимал её! А сейчас хочется хоть немного подучить основные фразы. Но не могу найти учебник.",2015-01-14 21:06:21,0,0,0
83,"А об этой Анне Тулла есть какая-нибудь инфа? Вроде молодая, а неплохо владеет... Или сейчас неплохо владеют хотя-бы веппским?)",2014-12-27 23:05:46,0,0,0
80,"Всегда в детстве, когда приезжала к бабушке, с утра слушала новости на карельском. Интересно так было :) И никто не стал учить родному языку... Жалко",2014-12-10 15:28:10,4,0,0
79,"Подскажите, пожалуйста, где найти слова, которые бы читались с русской ё в начале (надо подобрать кличку плем. животному)",2014-12-06 13:05:00,0,0,0
76,"Уважаемые, помогите перевести на карельский : ""карельская месть""",2014-11-30 12:43:15,0,0,0
73,"Ищу желающих с красивым голосом😃 для записи размещенных в группе ""фраз на карельском"" в аудио формат?",2014-11-22 20:54:37,4,0,0
72,"Карельско-Русский словарь, северо-карельские диалекты. http://cs539313.vk.me/u74291995/docs/c22eaa36b863/slovar_zajkov.pdf?extra=GTp89o3yQZLa6mGhxxfp85iezjZM4MskDj5j5PGiuTvhKBvBgKzEVHpVmaoLc_Y4c5P4eCiBNSyYKgkRRulNpg2jCNBBGiny",2014-11-22 20:14:06,7,1,0
71,Сказ о рыбке и рыбаке на Карельском языке http://vk.com/doc104100699_334444371?hash=987aa43313390db5e4&dl=67c99317e158ba04a3&api=1,2014-10-17 16:45:23,6,1,0
63,Большой Русско-карельский словарь  (ливвиковское наречие) http://www.krc.karelia.ru/doc_download.php?id=6136&table_name=publ&table_ident=9070,2014-09-27 20:23:10,14,3,0
60,"4 октября в городе Лихославль, Тверская область, в краеведческом музее начнутся бесплатные курсы Карельского языка",2014-09-13 15:06:00,4,0,0
57,"Ramenskan raionaşşa kareilautanda mänöy hilläillä harpavukşilla. ...ei kaikissa karielan şkolьssa lapsia opaşşeta omalla kielellä. Opastajat-karielat ice vielä ei mahata lugie i kirjuttua karielaksi, otua hotj Lavrovan şkola. Opaştajat Erşova i Mazeeva ice ei maheta lugie i kirjuttua omalla kielellä i ei tahota opaştuo, a niin že ei opaşşeta i lapsie. Kiändämižen ke massovo-politikahistja ruadua seljsovietoissa i toizissa yhteyttynejzissä organizacijoissa omah kieleh, aziet on niin že pahoin. Karielan seljsovietat Aleškinan kustua rešittih kaikki omah massovoin ruavon seižattua omalla kielellä, no konža ruvettih proverimah, midä luaittih karielautandua myötj, nin ožuttauci, şto niken nimidä ei luadin... Kolhozoin puoleh, 1931.",2014-09-10 19:37:17,0,0,0
51,"Словарь Карельского языка автор Пунжина А.В., в таком качестве выкладывать?",2014-09-10 14:49:20,1,0,0
49,"Фразы, с переводом на Карельский язык (русскими буквами). Выпуск 2.",2014-08-19 16:19:06,5,0,0
47,"Очень хотелось бы узнать о  реальном распространении карельского языка, и еще как будет по-карельски ""Лошадь"" или ""Конь""?",2014-07-13 12:49:01,0,0,0
39,"Фразы, с переводом на Карельский язык (русскими буквами).",2014-06-23 16:08:03,5,0,0
37,"(карельский) Толмачевская А. - Родное карельское. Карельско-русскій букварь для легчайшаго обученія грамотѣ карельскихъ дѣтей / Карельско-русский букварь для легчайшего обучения грамоте карельских детей [1887 г., PDF] http://rutracker.org/forum/viewtopic.php?t=4294987",2014-06-04 15:51:57,5,0,0
29,Карлова О. Карельский для начинающих Скачать бесплатно,2014-04-22 22:35:05,5,0,0
20,"Партия ""Финно-угорские народы России"". http://vk.com/club37484154",2013-05-20 19:24:27,0,0,0
11,может быть этот сайт подойдет:) уроки Карельского языка. http://depvladimir.narod.ru/urokkat/urok1.html,2012-11-09 15:37:46,0,0,0
2,"No nii Ja missä oppimateriali? mikä dialekti te opiskelette? Ryhmän lippu on UHTAN Krjalan lippu - se on pohjois dialekti, mutta seinalla on kirjoitanut etta Paul haluu oppi Tverin dialekti",2011-12-04 12:34:13,0,0,0
