id,text,date,likes,reposts,views
1286,"15 мая Международный день семьи!! Нет крепче на земле союза, чем счастливая и дружная семья. Это и начало новой жизни, и продолжение прекрасного рода, и почитание святости традиций. Семья — это наивысшее счастье, которое человек может создать сам.  Сегодня, в Международный день семьи, хочется пожелать: пусть детский смех раздается повсюду, а родные будут вам верной опорой. Пускай вас всегда согревает тепло любви. Желаем вашим семьям быть цветущими дружными и сплоченными. Благополучия и добра всем семьям!  Интересные факты  В Древнем Риме официальный брак заключался при помощи поцелуя.  Согласно мировой статистике после 7 лет супружеской жизни вероятность развода уменьшается на 50%.  Китаец Цион Хан, который проживает в Индии, обзавелся самой большой семьей в мире. Он женат на 39 женщинах, которые родили ему 94 ребенка. Семейную историю продолжили 33 внука.  По статистике женатые мужчины и замужние женщины живут дольше тех, кто так и не вступил в брак или развелся.  Традиция носить обручальное кольцо на безымянном пальце пришла из Древнего Египта. Египтяне верили, что именно в этом пальце берет начало вена любви, которая несет кровь к сердцу.  Согласно наблюдениям, самой распространенной песней для первого брачного танца среди молодоженов является баллада Брайана Адамса «Everything I Do».",2021-05-15 09:03:13,16,0,452
1285,"Друзья😉  Представляем новое видео в рамках проекта ""Школа молодых ремесленников"", посвященное художественной резьбе по дереву.    О том, как в современном мире может найти себя традиционное ремесло расскажет замечательный мастер-краснодеревщик, руководитель компании ""Карельские мастера"" - Михаил Якубенко 📽    Ролик создан в рамках реализации проекта ""Школа молодых ремесленников"", получившего поддержку Фонда президентских грантов в 2020 году.    #шмр #карелия #резьба #ФПГ #поддержитрадиции",2021-05-15 08:55:20,3,0,334
1277,"9 мая - священный и дорогой для каждого из нас праздник, который мы встречаем с особыми чувствами. Мы всегда будем чтить подвиг тех, кто героически сражался на фронтах Великой Отечественной, трудился в тылу, восстанавливал страну в послевоенные годы.  Для жителей села Вешкелица 9 мая особенный, светлый праздник.  В этот день мы приходим на Братскую могину войнов,павших в годы Великой Отечественной войны почтить память захороненных и увековеченных, возложить ветку славы.  В Братской могиле захоронено 46 войнов, из них 38 известных и 8 неизвестных.  Увековеченных на плитах Братской могилы 117 человек. Желаем всем никогда не падать духом и всегда помнить, что в этом мире всё можно преодолеть, если нет войны.  Цените мир, дорожите близкими, будьте благодарны нашим дедам, отдавшим свои жизни за нашу жизнь.  Всем здоровья, благополучия, любви и счастья, а также большой и искренней гордости за великий подвиг великих людей!",2021-05-09 20:52:32,58,1,703
1271,"Сегодня, 9 мая, состоялась премьера театрализованной постановки ""Марьино поле"", по мотивам пьесы Олега Богаева. Постановка посвящалась вдовам участников Великой Отечественной войны.  Это рассказ об огромной, вечной любви, для которой нет срока давности.  Спасибо огромное всем участникам постановки!!! Корниловой Альбине, Поповой Валентине, Логиновой Светлане, прекрасно сыгравших главных героинь Серафиму, Машу и Прасковью. Малаховскому Николаю, сыгравший роль мужа Маши.  Большое спасибо Стельмаху Павлу, Матчанову Егору и Воробьёву Льву, сыгравших роль солдат.  Участникам коллективов за музыкальное оформление спектакля: «Veškelys», «Paivuzet”, «Kuldaine», «Revinnyh kottu», «Kareločka».    Режиссеру по звуку  Малаховскому Максиму, которому досталась одна из самых сложных работ.   За прекрасные декорации Власовой Любовь.  За идею и правильно подобранное музыкальное сопровождение спектакля Агафоновой Светлане.  Огромное спасибо зрителю за теплый прием!!!!  Всем участникам низний поклон!!! Крепкого здоровья, оптимизма и творческих успехов!!!!  С праздником Днём Великой победы!!!!",2021-05-09 18:42:01,100,4,3078
1268,"Дорогие односельчане, примите самые искренние поздравления с Днём Великой победы!!! 9 Мая - священный и дорогой для каждого из нас праздник, который мы встречаем с особыми чувствами.  Мы всегда будем чтить подвиг тех, кто героически сражался на фронтах Великой Отечественной, трудился в тылу, восстанавливал страну в послевоенные годы.  Низкий поклон всем, кто приближал Великую Победу!",2021-05-08 22:26:31,29,0,487
1262,Мероприятие проводится с соблюдением всех санитарных норм! +18,2021-05-08 12:36:13,14,6,434
1260,"Спасибо деду за Победу,  За каждый отстоявший дом  За небо чистое, за веру,  За то что мы теперь живем!  С праздником! 🚩🚩🚩                 Спортивная команда Вешкельской школы ""Адреналин""",2021-05-07 22:47:36,45,4,865
1258,"Весна майская!  Весна сорок пятого года  Так ждал тебя синий Дунай  Народам Европы свободу  Принес жаркий солнечный май  На площади Вены спасенной  Собрался народ стар и млад  На старой израненной в битвах гармони  Вальс русский играл наш солдат  06 мая тепло встретили Победную майскую весну в этноцентре ""Вешкелюс"". Течет река времени. Минуло уже 76 лет с той незабываемой Майской весны, весны 45 года.  9 мая - это общий праздник всего нашего народа, всего человечества и праздник каждого человека.  Мы пели, с удовольствием отплясывали ""Яблочко"" и и конечно танцевали самый главный танец Великой Отечественной войны, танец, прошедший всю войну, - ВАЛЬС!",2021-05-07 17:53:30,57,1,2246
1244,"От всей души поздравляем майских юбиляров!!! Долгову Емилию Константиновну 💐 Парфентьева Ивана Николаевича 💐 Логинову Раису Васильевну 💐 Свирид Юрия Евгеньевича 💐 Няргину Елену Александровну 💐 Чайкину Галину Михайловну💐💐💐  С уважением,  Совет ветеранов с.Вешкелица, этноцентр и все жители села",2021-05-05 13:57:27,32,0,698
1242,"Приближается великий и святой праздник – День Победы нашего народа в Великой Отечественной войне,  и мы вновь и вновь возвращаемся к тем памятным дням. Мы помним, какой ценой досталась нашим дедам эта Великая Победа. Вряд ли есть семья, которой не коснулась война.  У кого-то воевал дед, у кого-то отец, сын, муж.  В этот день, прежде всего, хочется сказать «спасибо» за жизнь и мирное небо над головой.  Пожелать мира и процветания, здоровья и счастья, успехов и благополучия!  В этот знаменательный день, 9 мая в 13.00 приглашаем жителей и гостей села на премьеру театрализованной постановки ""Марьино поле"", по мотивам пьесы Олега Богаева.  Марьино поле» тема войн и вечных вдов России.  Спектакль о любви—вечной, красивой, той, что вне времени и пространства… Об упрямой, безоговорочной вере. Такой, перед которой отступают даже здравый смысл, время и сама смерть…   Три старухи Серафима, Прасковья и Маша доживают свой век в опустевшей деревеньке. Доживают не просто так, а со смыслом, поскольку не перестают ежедневно ждать возвращения с фронта своих мужей. Не важно, что прошло больше полувека с той войны.  И похоронки, которые каждая из героинь как реликвию хранит рядом с иконкой, ничего не доказывают.  Верят старухи — и ждут, вспоминают прошлое.  Когда же к одной из них является во сне давно пропавший супруг и заявляет — мол, возвращаются мужики, к 9 мая все будут дома — старухи бодрым строевым шагом отправляются на станцию — встречать героев.  Герои истории переплывают таинственную небесную реку и попадают в мир, где все их желания сбываются, стоит им лишь протянуть руку.   «Марьино поле» — притча о любви, над которой оказалась не властна ни старость, ни смерть.   РОЛИ ИСПОЛНЯЮТ: Маша - Попова Валентина  Прасковья— Логинова Светлана  Серафима - Корнилова Альбина  Ваня - Малаховский Николай   МУЗЫКАЛЬНОЕ СОПРОВОЖДЕНИЕ  Фольклорный коллектив «Veškelys»  Фольклорная группа «Paivuzet”  Танцевальный коллектив «Kuldaine» Фолк. группа «Revinnyh kottu» Вокальная группа «Kareločka»    ОПЕРАТОР ПО ЗВУКУ  Малаховский Максим    ДЕКОРАЦИИ  Власова Любовь    РЕЖИССЁРЫ  Погребовская Ирина  Агафонова Светлана  Мероприятие проводится с соблюдением всех санитарных норм.",2021-05-04 17:18:43,59,3,1056
1241,Маёвка N 5! Всем огромное спасибо!! #ЗАВЕСНУЗАВИСНУ,2021-05-03 22:22:07,82,3,3808
1237,Христос воскресе!,2021-05-02 07:53:59,28,0,478
1232,"В период с октября 2020 года по апрель 2021 года в 8 районных центрах Республики Карелия прошли мастер-классы проекта ""Метафорическое рисование VR"". Проект реализовывался при финансовой поддержке Федерального агенства по делам молодежи ""Росмолодежь"", партнерами проекта выступили ГАУ ""Карельский региональный центр молодежи"" и Петрозаводский государственный университет.    В рамках проекта команда во главе с художником Владимиром Одинцовым рассказала. как развивалось искусство от наскальной живописи до современных технологий виртуальной реальности. Также каждый участник проекта, а их было более 200 человек, попробовал себя в роли художника виртуальной реальности. Стоит отметить, что большинство участников проекта являлись учащимися художественных школ, школ искусств, центров дополнительного образования, что, конечно, существенно, упрощало восприятие технологий методики рисования. Данной технологии рисования сейчас около 5 лет, это динамично развивающийся вид искусства, о котором вскоре мы будем узнавать все больше и больше. Участники проявляли большой интерес, задавали много вопросов.    Команда проекта благодарит всех участников за проявленный интерес, представителей подведомственных учреждений Министерства образования и спорта РК, а также Министерства культуры РК за помощь в реализации проекта в муниципальных районных центрах.    https://vk.com/album-96736464_273443052    #росмолодежь  #росмолгрант  #росмол  #фадм  #фадмросмолодежь",2021-05-01 08:56:30,3,0,341
1217,"Детский сад! Весенние, победные окошки!!!",2021-04-29 15:49:25,56,0,761
1216,Приглашаем односельчан 03 мая на Маёвку! Сбор у этноцентра в 12.00!,2021-04-29 08:34:10,17,3,498
1215,"Воскресенье, 2 мая  Светлая Пасха ! Часовня будет открыта в 10.00! С наступающим праздником!!!",2021-04-28 14:31:51,16,0,451
1214,Посвящается Дню Великой Победы!    Клип снимался в Медвежьегорском и Пряжинском районе (видеосъёмка Борис Конанов).  Песня «День Весны»: сл. Александр Костюнин; муз. Людмила Тимоева; ар. Илья Гульчук и Артём Хиля; вок. Наталья Хиля;    Андрей Константинов,2021-04-27 21:10:07,14,3,509
1210,"Предлагаем посмотреть два сюжета в «Viestit Karjala» vepsän, karjalan da suomen kelel 23. sulakud О выставке значков и монет и мероприятие ""САМ СПОЮ Я ПЕСНИ ПРЕДКОВ""",2021-04-23 15:15:20,6,1,414
1208,25 апреля - Вербное воскресенье! Часовня будет открыта с 10.00 С наступающим праздником!,2021-04-23 08:58:27,33,0,454
1207,"Сегодня, 22 апреля, в этноцентре ""Вешкелюс"" жители села писали диктант на карельском языке.  Все успешно справились с текстом и получили сертификаты об участии в Акции. Читала текст Серебрянникова Оксана, педагог карельского языка. МОЛОДЦЫ!!!!  Акция ""Диктант на карельском и вепсском языках"" проходит в период с 20 по 25 апреля в Карелии, Ленинградской, Тверской и Вологодской областях. Диктант на карельском и вепсском языках проходит ежегодно с 2014 года.",2021-04-22 22:02:21,44,2,2722
1201,"САМ СПОЮ Я ПЕСНИ ПРЕДКОВ Инсценировка «Старцы»,  руну читают Воробьев Лев Петрович и Князев Сергей Владимирович  Перевод на карельский язык Воробьев Л.П.",2021-04-20 16:01:07,24,2,455
1200,"САМ СПОЮ Я ПЕСНИ ПРЕДКОВ  19 апреля в этноцентре «Вешкелюс» прошло замечательное мероприятие клуба «Земляки, посвященное году карельских рун. Была проведена совместная подготовительная работа сельской библиотеки, этноцентра, КРОО «Родной очаг». Оформлены выставки, заранее раздали участникам руны. И в первые, в нашем мероприятии участвовали учащиеся Вешкельской средней школы с педагогами Муравко Надеждой Васильевной и Агафоновой Светланой Николаевной. Открыли выступления «Старцы» (Воробьев Лев Петрович и Князев Сергей Владимирович). Инсценировка руны «Илмаринен» в исполнении учащихся поразила всех присутствующих. Ребята очень хорошо подготовились. У них все было на уровне: костюмы, реквизит, подобраны все детали. Члены клуба «Земляки» очень выразительно исполнили руны. Выступили практически все члены клуба. После литературной части были традиционное чаепитие.  А еще была страничка «Ударим юмором по COVID». Где были прочитаны стихи Павла Клокова, корреспондента газеты «Комсомольская правда», как бы о COVID могли бы написать известные поэты Маяковский, Есенин, Высоцкий и другие.  Мероприятие всем понравилось, расходились с хорошим настроением.  Большое спасибо всем участникам.",2021-04-20 15:42:38,83,5,3139
1186,"Сегодня, в этноцентре «Вешкелюс», прошла замечательная выставка значков и монет из коллекций членов КАРЕЛЬСКОГО РЕГИОНАЛЬНОГО ОТДЕЛЕНИЯ ОБЩЕРОССИЙСКОГО ОБЩЕСТВЕННОГО ДВИЖЕНИЯ «В ПОДДЕРЖКУ АРМИИ, ОБОРОННОЙ ПРОМЫШЛЕННОСТИ И ВОЕННОЙ НАУКИ» Гущина Андрея Ивановича, Деготь Евгения Анатольевича и Бредихина Юрия Владимировича, приуроченная к празднованию Дня космонавтики, 12 апреля и День Победы, 9 мая. Выставку посетили жители села, учащиеся Вешкельской средней школы, члены КРОО «Родной очаг». Интересный рассказ Андрея Ивановича Гущина о фалери́стике — науке о значках, не оставил никого равнодушным. История страны в значках. Самые первые значки были найдены у древних людей. И вот, сейчас, в маленьком значке можно увидеть целую эпоху. Значки СССР и ранее. Например нагрудной знак ""ВОРОШИЛОВСКИЙ СТРЕЛОК"" (88 лет назад, 29 декабря 1932 года, в СССР установлено почетное звание «Ворошиловский стрелок» 1-й и 2-й степеней). Спасибо большое КРО ДПА  Гущину А.И., Деготь Е.А. и Бредихину Ю.В. Надеесмся на дальнейшее взаимовыгодное сотрудничество!",2021-04-15 18:58:12,54,2,2412
1183,18.04.2021 с 12.00 до 16.00 в этноцентре будет вести приём врач офтальмолог- оптометрист.  Компьютерная диагностика. Подбор и продажа очков и контактных линз любой сложности.,2021-04-12 22:34:54,14,4,587
1182,"Уважаемые участники клуба ""Земляки""!  Заседание, назначего на 19 апреля в 13.00, в понедельник.",2021-04-12 14:34:42,7,0,432
1181,"Уважаемые участники клуба ""Земляки""! Заседание, запланированное на 14 апреля в 13.00 переносится на другой день.   Спасибо за понимание!",2021-04-12 10:36:40,9,0,399
1179,"Четвертая публикация видео из серии ""В архив, не выходя из дома"" в рамках проекта Карелия - с заботой об истории. (https://vk.com/karelia_s_zabotoi)    Из лекции главного архивиста отдела использования и публикации документов Национального архива Республики Карелия ""Как читать рукописные тексты?"" Суржко Ольги Игоревны вы узнаете, какие трудности могут встретиться при чтении текстов досоветского периода, о скорописном письме, реформах Петра I и об ""особенных"" буквах, которые использовались в то время.    Проект реализуется при поддержке фонда Президентских грантов.    #фондпрезидентскихгрантов; #крцм; #карелиясзаботойобистории",2021-04-07 20:22:34,0,1,369
