id,text,date,likes,reposts,views
3204,"Молодежная этносессия | #ЭтноЛето ☀    Тебе от 18 до 35?  Интересуешься языками и культурой коренных народов Карелии?  Хочешь узнать, как внести свой вклад в развитие малой родины?    Тогда скорее заполняй заявку на участие в Молодежной сессии по вопросам этнокультурного развития коренных народов Республики Карелия!    Тебя ждут:  👫новые знакомства;  🎉насыщенная культурная программа;  🚌экскурсии и мастер-классы;  📚различные лекции о саморазвитии;  🤝встречи с интересными людьми, посвященные этнокультурному многообразию Карелии и вопросам государственной национальной политики.    Этносессия пройдет с 7 по 10 августа 2023 г. в г. Петрозаводске.  Приходи за новыми знаниями, незабываемыми впечатлениями и отличным настроением!!!✨    Присоединяйся к нашей группе ""ВКонтакте"" Молодежная сессия ""Этно лето"" , где ты сможешь увидеть материалы и фото с прошлых встреч.    Заявки на участие принимаются до 14 июля 2023 г. на адрес anufrieva@nac.gov10.ru. Дополнительную информацию можешь получить по телефону (8142) 78-43-55 доб. 303.    Форма заявки👇    Организаторы мероприятия: Министерство национальной и региональной политики Республики Карелия и Издательство ""Периодика"".📖  #МБУэтнокультурныйцентрВешкелюс",2023-06-27 16:12:35,4,2,370
3202,"#тематическиенедели_здоровье  #МБУэтнокультурныйцентрВешкелюс  26 июня - 2 июля Неделя профилактики рака легких    Рак легких – один из наиболее распространенных видов онкологических заболеваний, который может привести к серьезному ухудшению качества жизни и даже к смерти. Однако, если вовремя обратиться к врачам и начать лечение, шансы на полное выздоровление значительно возрастают. Именно поэтому с 26 июня по 2 июля проводится Неделя профилактики рака легких.    Цель этой недели – привлечение внимания к проблемам, связанным с этим заболеванием, а также повышение осведомленности населения о том, как предотвратить рак легких.  Обращайте внимание на своё здоровье, берегите свои легкие и не стесняйтесь обращаться за помощью, если появятся любые подозрительные симптомы.",2023-06-26 15:15:53,0,1,414
3201,"#тематическиенедели_здоровье  #МБУэтнокультурныйцентрВешкелюс  С 26 июня - 2 июля Неделя профилактики рака легких    📌Целью мероприятия является повышение информированности пациентов и членов их семей о влиянии факторов образа жизни на риск возникновения первичных онкологических заболеваний и их рецидивов.    📌Факторы риска развития рака легкого можно разделить на две категории — внутренние и внешние. К первым относится наследственный анамнез: если кто-то из кровных родственников болел или погиб от рака легкого, то у этого человека повышен риск развития рака легкого. Также к внутренним факторам риска нужно отнести хронические заболевания легкого, которые также автоматически переводят человека в группу риска.    📌Все остальные факторы внешние. Это работа, связанная с вредными химическими, с дизельными выхлопами, с асбестом, мышьяком и так далее. Работа в помещениях с повышенной запыленностью, с повышенным количеством радона.  📌Профилактика рака лёгких включает следующие рекомендации:  📎отказ от вредных привычек, в первую очередь от курения. Курение является причиной развития более двадцати двух злокачественных новообразований различных локализаций и увеличивает риск развития рака легкого более чем в 15 раз.  📎соблюдение здорового образа жизни: правильное питание, богатое витаминами, и ежедневные физические нагрузки, прогулки на свежем воздухе;  📎своевременное лечение заболеваний бронхов, чтобы не было перехода в хроническую форму;  📎проветривание помещения, ежедневная влажная уборка квартиры;  📎необходимо снизить контакт с вредными химическими веществами и тяжелыми металлами до минимума. Во время работы обязательно использовать средства защиты: респираторы, маски.  👉Рекомендация пациентам, прошедшим хирургическое лечение, и тем, кто ни разу не сталкивался с онкологической патологией: внимательно относиться к своему здоровью, выполнять рекомендации врача по динамическому наблюдению. А тем, кто не столкнулся с заболеванием, не игнорировать ежегодную диспансеризацию.  #тематическиенедели_здоровье",2023-06-26 15:14:55,1,0,302
3200,#МБУэтнокультурныйцентрВешкелюс,2023-06-26 11:16:56,6,0,269
3199,#МБУэтнокультурныйцентрВешкелюс,2023-06-26 11:16:36,4,0,247
3197,"#тематическиенедели_здоровье  #МБУэтнокультурныйцентрВешкелюс  💪 С 19 июня по 25 июня 2023 года Министерство здравоохранения Российской Федерации объявило неделей информирования о важности физической активности.  ❓Как привнести физическую активность в свою жизнь? В современном мире физическая активность населения продолжает снижаться: каждый четвертый взрослый человек двигается недостаточно. Это связано с нашим образом жизни, что создает благоприятные условия для возникновения физической инертности: даже продукты можно заказать, не выходя из дома. Однако физическая активность жизненно необходима каждому их нас не только для хорошего самочувствия, доказано, что регулярные занятия снижают риски развития сердечно-сосудистых заболеваний, ожирения и сахарного диабета 2 типа, а также уменьшает симптомы тревожности и депрессии, улучшает мыслительную деятельность. Как мы видим, позитивных причин больше двигаться достаточно много, но многие люди не делают этого из‑за отсутствия привычки, нехватки времени или сил. Поэтому в этом материале поговорим о том, как набрать необходимое количество физической нагрузки даже тем, кто имеет очень плотный график.  ☝ Помните любая активность лучше, чем её отсутствие, поэтому выберите для себя 2-3 подходящих варианта и постепенно работайте над укреплением новой привычки двигаться больше. Ходьба пешком  Ходьба имеет намного меньше противопоказаний и ограничений по сравнению с бегом, и пусть она не так энергозатратна, тем не менее ходьба все равно тренирует сердечно-сосудистую систему и поднимает настроение. Старайтесь ходить больше при любом удобном случае: - вместо того что бы сидеть на месте, выгружайте из стиральной машины и развешивайте вещи по одной, а не целой кучей; - выйдите на остановку раньше по пути с работы домой; - пользуйтесь лестницами вместо лифтов. Причем, подъемы и спуски с лестницы позволяют сжигать даже больше калорий по сравнению с обычной ходьбой; - паркуйтесь подальше от места назначения, что бы пройти лишние 100-200 метров.  🤸 Зарядка, разминка и растяжка везде. Зарядка не требует много времени и длиться не более 10-15 минут, а разминка на рабочем месте не займет более 5 минут. Это придаст вам бодрость и силы, позволит более эффективно выполнять умственные задачи. Если на полноценную зарядку не хватает времени, сделайте одно-два упражнения пока закипает чайник и заваривается чай, а некоторые упражнения и растяжку можно выполнять даже сидя.  🚶‍♀Не забывайте двигаться. Многие фитнес-браслеты и часы, а также мобильные приложения оснащены функцией напоминания о том, что вы долго сидите и вам нужно подвигаться. Так же можно просто поставить будильник на каждый час. Сделайте 5-минутный перерыв от работы, пройдитесь по коридору, сделайте разминку.  🏌‍♂Подвижные игры. Хороши в любом возрасте, это может быть вашим хобби или способом приятно провести время с семьей подурачиться с детьми. Отлично подходит для владельцев собак.  Проводите больше времени в движении. В любом ожидании, стоя в очереди, или пока обновляется компьютер, можно пританцовывать, или ходить вокруг своего рабочего места.  🏃‍♂Будьте физически активными!",2023-06-22 16:55:32,0,0,349
3195,"22 июня — день начала войны, И пусть пролетают годы, День этот помним мы. Для нас навсегда остался Днем памяти он и скорби, Сегодня мы имена, Всех невернувшихся вспомним. Замрем в минуте молчания, Лишь сердце удар пропустит, Прошу, не забудьте люди, Те страшные дни - начала той страшной войны.  22 июня жители и гости нашего села собрались вместе на Братской могиле войнов павших в годы Великой Отечественной войне, чтобы вспомнить и почтить наших ветеранов,  ребят, которые нашли покой в Братской могиле с.Вешкелица. Возложить цветы и поклониться всем, кто подарил нам право жить.   #МБУэтнокультурныйцентрВешкелюс",2023-06-22 12:41:07,49,4,937
3194,"В настоящее время в этноцетре ""Вешкелюс"" проходит заседание Совета по развитию малого и среднего предпринимательства. Выступление Лучина Романа Владимировича ""Меры государственной поддержки малых форм хозяйствования"" заинтересовало присутствующих. Много было задано вопросов. Людей интересует вопросы создания сельскохозяйственных кооперативов, меры гос.поддержки. Животовская Светлана Владимировна проинформировала об условиях кредитования субъектов малого и среднего предпринимательства.  На заседание так же обсудили вопросы:  - применение специальных налоговых режимов (докладчик: главный государственный налоговый инспектор отдела оказания государственных услуг – Лазарева Ольга Константиновна),  - преимущества получения массовых социально-значимых услуг в электронном виде (докладчик: ведущий специалист отдела по развитию предпринимательства и инвестиционной политики Администрации Суоярвского муниципального округа - Фомина Анна Николаевна),  - государственная поддержка работодателей в 2023 году(докладчик: ведущий профконсультант Агентства занятости Суоярвского района –Зряхова Наталья Владимировна) Выступающие постарались дать полные, развёрнутые ответы.   #МБУэтнокультурныйцентрВешкелюс",2023-06-22 11:53:21,9,0,460
3192,#МБУэтнокультурныйцентрВешкелюс,2023-06-22 09:37:14,20,0,391
3190,"22 июня в 11.00 в этноцентре состоится заседание Совета по развитию малого и среднего предпринимательства. Повестка дня: 1. Меры государственной поддержки малых форм хозяйствования (докладчик: главный аналитик ГБУ РК «Республиканский центр ветеринарии и консультирования» – ЛучининРомн Владимирович) 2. Условия гарантийной и финансовой поддержки Фондом по содействию кредитованию субъектов малого и среднего предпринимательства Республики Карелия (докладчик: консультант – Животовская Светлана Валерьевна)  3. Отдельные вопросы применения специальных налоговых режимов. Налоговые каникулы для индивидуальных предпринимателей, применяющих УСН и ПСН. Уменьшение налога при применении УСН и ПСН на страховые взносы (докладчик: главный государственный налоговый инспектор отдела оказания государственных услуг – Лазарева Ольга Константиновна) 4. Преимущества получения массовых социально-значимых услуг в электронном виде (докладчик: ведущий специалист отдела по развитию предпринимательства и инвестиционной политики Администрации Суоярвского муниципального округа - Фомина Анна Николаевна)  5. Государственная поддержка работодателей в 2023 году(докладчик: ведущий профконсультант Агентства занятости Суоярвского района –Зряхова Наталья Владимировна)  #МБУэтнокультурныйцентрВешкелюс",2023-06-21 12:51:12,0,0,332
3189,"Уважаемые односельчане! Приглашаем 22 июня в 12.00 на возложение цветов к памятнику Братской могилы воинов павших в годы Великой Отечественной войне.  День памяти и скорби - 22 июня 2023 года – это годовщина начала Великой Отечественной войны. Именно в этот день летом 1941 года началась самая кровопролитная и страшная война в истории нашей страны, явившаяся основной частью Второй мировой войны 1939-1945 годов.  #МБУэтнокультурныйцентрВешкелюс",2023-06-21 12:46:17,21,0,653
3188,"21 июня с 11.00 до 13.00 в этноцентре ведёт приём граждан специалисты социального обслуживания населения, Отделения Социального фонда России по Республике Карелия, и представителями ГКУ СЗ РК «Центр социальной работы Республики Карелия»  по вопросам:  - предоставления социального обслуживания (социальных услугах, предоставляемых учреждением, порядке их получения);  - получения во временное пользование технических средств реабилитации;  - социально-правовым вопросам и вопросам пенсионного обеспечения;     #МБУэтнокультурныйцентрВешкелюс",2023-06-21 12:37:40,6,1,371
3186,"Сегодня, 20 июня, нашим выпускникам Вешкельской средней школы торжественно вручили аттестаты об основном общем образовании и аттестаты о среднем (полном) общем образовании.   Выпускники, вас искренне поздравим,  Желаем силы — труден в жизни путь,  Но вы цените то, что будет главным:  Друзей, здоровье и в семье уют!  Желаем вам найти ваше призванье.  Пусть будут рядом те, кто верит в вас, Исполнятся заветные желания,  Чтоб ваша жизнь успешно удалась.  Чтобы ошибок в жизни меньше было,  Вы оставайтесь навсегда собой,  Чтоб весело и беззаботно жили  Надежда с вами, вера и любовь!   #МБУэтнокультурныйцентрВешкелюс",2023-06-20 22:16:41,64,3,1235
3184,#МБУэтнокультурныйцентрВешкелюс,2023-06-20 13:52:55,2,1,177
3183,"#тематическиенедели_здоровье  #МБУэтнокультурныйцентрВешкелюс  С 19 по 25 июня в России проходит «Неделя информирования о важности физической активности» .    Помните любая активность лучше, чем её отсутствие, поэтому выберите для себя 2-3 подходящих варианта и постепенно работайте над укреплением новой привычки двигаться больше.    Ходьба пешком    Ходьба имеет намного меньше противопоказаний и ограничений по сравнению с бегом, и пусть она не так энергозатратна, тем не менее ходьба все равно тренирует сердечно-сосудистую систему и поднимает настроение. Старайтесь ходить больше при любом удобном случае:  -выйдите на остановку раньше по пути с работы домой;  -пользуйтесь лестницами вместо лифтов. Причем, подъемы и спуски с лестницы позволяют сжигать даже больше калорий по сравнению с обычной ходьбой;  -паркуйтесь подальше от места назначения, что бы пройти лишние 100-200 метров.    Зарядка, разминка и растяжка везде    Зарядка не требует много времени и длиться не более 10-15 минут, а разминка на рабочем месте не займет более 5 минут. Это придаст вам бодрость и силы, позволит более эффективно выполнять умственные задачи. Если на полноценную зарядку не хватает времени, сделайте одно-два упражнения пока закипает чайник и заваривается чай, а некоторые упражнения и растяжку можно выполнять даже сидя.    Не забывайте двигаться    Многие фитнес-браслеты и часы, а также мобильные приложения оснащены функцией напоминания о том, что вы долго сидите и вам нужно подвигаться. Так же можно просто поставить будильник на каждый час. Сделайте 5-минутный перерыв от работы, пройдитесь по коридору, сделайте разминку.    Проводите больше времени в движении    В любом ожидании, стоя в очереди, или пока обновляется компьютер, можно пританцовывать, или ходить вокруг своего рабочего места.    Будьте физически активными!💯🏃‍♂🕺",2023-06-19 17:52:28,0,1,368
