id,text,date,likes,reposts,views
2661,"Татьяна Голикова: Поддержка людей с инвалидностью и их близких всегда была и остается одним из ключевых приоритетов государственной политики России  2 декабря Татьяна Голикова, Заместитель Председателя Правительства Российской Федерации, выступила на открытии общероссийской акции по проверке знаний в сфере доступной среды и инклюзии – Тотальный тест «Доступная среда». До конца Декады инвалидов жителям России предстоит ответить на 50 вопросов о правах и потребностях людей с инвалидностью.   Тотальный тест «Доступная среда» стартовал 2 декабря в 10:00 по московскому времени: акция традиционно приурочена к Международному дню инвалидов и проводится в онлайн-формате. Уже в первые часы к акции присоединились более 200 тысяч жителей России более чем из 10 000 городов и населенных пунктов.   К россиянам обратились почётные гости мероприятия – общественные и государственные деятели, руководители общероссийских организаций инвалидов, представители культуры и искусства.  «Цель Тотального теста «Доступная среда», прежде всего, в просвещении широкого круга участников - акция позволяет привлечь внимание граждан России к правам и потребностям людей с инвалидностью и повысить уровень знаний специалистов социально значимых сфер в вопросах взаимодействия, этики общения и создания доступной среды», – сказала Татьяна Голикова, Заместитель Председателя Правительства Российской Федерации.   В этом году вопросы Тотального теста зачитали актёры театра и кино Данила Козловский и Никита Ефремов, народная артистка России Диана Гурцкая, Уполномоченный при Президенте РФ по правам ребёнка Мария Львова-Белова, председатель Всероссийского общества инвалидов, депутат Государственной Думы ФС РФ Михаил Терентьев, президент Всероссийского общества глухих Станислав Иванов, директор Ассоциации «АУРА-Тех» Иван Бирюков.  Каждый вопрос тестирования посвящен правилам оказания помощи людям с инвалидностью, нормам и этике общения, созданию доступной среды, применению ассистивного оборудования.  Тестирование завершится подведением итогов и разбором правильных ответов на вопросы, в ходе которого ведущие эксперты расскажут участникам акции о правилах оказания ситуационной помощи и о том, как правильно взаимодействовать с людьми с инвалидностью.   «Участие в акции позволяет каждому жителю России не только узнать что-то новое и получить практические знания на тему инклюзии, но и в целом снять барьеры в общении. Мероприятие ярко показывает уровень вовлеченности регионов в создание доступной среды и услуг, заинтересованность властей в повышении компетенций работников социальной сферы», – сказал Иван Бирюков, председатель Координационного совета по делам инвалидов Народного фронта, директор Ассоциации «АУРА-Тех».   3 декабря во всем мире отмечается Международный день инвалидов и традиционно проводятся общественно полезные мероприятия, посвященные соблюдению прав людей с инвалидностью, обеспечению инклюзии и созданию доступной среды.   В регионах России уже анонсированы более 5 тысяч социально значимых мероприятий – общественных дискуссий, форумов, выставок и других событий, которые позволят органам власти на местах вовлечь людей с инвалидностью в обсуждение и реализацию проектов в сфере инклюзии и доступной среды.  Так, в Ярославской области запланировано более 250 мероприятий, в Ямало-Ненецком автономном округе – более 300, а в Новосибирской области – более 1200 мероприятий и акций, посвященных теме инклюзии, участниками которых станут люди с инвалидностью.  «Поддержка людей с инвалидностью и их близких всегда была и остается одним из ключевых приоритетов государственной политики России. Многое в этой сфере уже было сделано, но остаются вопросы, которые еще предстоит решить. И задача органов власти и бизнеса на местах прислушиваться к запросам граждан, вовлекать людей с инвалидностью в обсуждение и реализацию программ по развитию территорий, создание доступной среды и услуг», – отмечает Татьяна Голикова, Заместитель Председателя Правительства Российской Федерации.  Организаторы Тотального теста «Доступная среда» – Народный фронт, Академия доступной среды и Ассоциация «АУРА-Тех». Мероприятие проводится при поддержке Минпромторга России. Активное участие в организации мероприятия принимают общественные организации и региональные органы власти субъектов РФ.  По результатам Тотального теста «Доступная среда» будет сформирован рейтинг по уровню вовлеченности субъектов Российской Федерации в мероприятия по созданию условий доступности социальной инфраструктуры и знаний по вопросам инклюзии.   Акция проводится в онлайн-формате – принять участие в акции может каждый житель России с любого персонального устройства, имеющего доступ в Интернет. Пройти тестирование можно будет со 2 по 10 декабря 2022 года в любое удобное время на сайте акции: www.total-test.ru ",2022-12-08 10:29:06,0,0,346
2659,"Новые возможности для просмотра фильмов: мобильное приложение «Особый взгляд» делает киноискусство доступным для людей с нарушением зрения.  Создание комфортной и доступной среды для всех россиян – один из приоритетов для Минкультуры РФ, отмечает глава ведомства Ольга Любимова.  Теперь насладиться новинками и классикой можно в кинотеатрах или дома: уникальная технология синхронизирует аудиодорожку тифлокомментария с основным звуком и интершумом фильма и автоматически воспроизводит ее для пользователя.  #МБУэтнокультурныйцентрВешкелюс",2022-12-07 16:34:27,3,0,401
2648,"Поздравляем декабрьских юбиляров! - Юппиеву Елену Ивановну и - Козлову Татьяну Евгеньевну.  От всей души желаем в Юбилей Вам радости, удачи и здоровья, И много светлых благодатных дней Добром согретых, нежностью, любовью. И рядом с вами будут пусть Всегда лишь близкие, приятные вам люди. И станет ярче этот мир тогда, И ваша жизнь счастливей будет.",2022-12-06 21:06:55,34,1,665
2644,#МБУэтнокультурныйцентрВешкелюс,2022-12-06 18:51:28,31,19,1321
2643,"А ты сможешь расшифровать формулу сказки?!  До конца школьного года детский музейный центр «Кижи» приглашает старшеклассников и студентов на занятие «Формула сказки».  Ты узнаешь о правилах построения текста, пространстве повествования, магических предметах и типах героев и научатся придумывать истории самостоятельно.  В основу музейного занятия положен анализ структурных разновидностей волшебной сказки русского ученого-фольклориста В. Я. Проппа, изложенный в монографии «Морфология волшебной сказки».  📗По В.Я Проппу, сказки можно разделить на несколько больших групп: бытовые, волшебные и сказки о животных. Наиболее сложным и интересным сюжетом отличается волшебная сказка, она имеет разветвленную композицию, которая строится по определенным правилам и развивается в особом порядке.  💯Мероприятие проводится в рамках программы «100 уроков музея «Кижи».  ☎Справки и заявки по телефонам: (814 2) 79-98-40, 8 921 455-65-66.  Напиши в комментариях, какая твоя любимая сказка?  #Кижи #Детскиймузейныйцентр #Пушкинскаякарта #сказка #ДМЦ@kizhi_museum  #МБУэтнокультурныйцентрВешкелюс",2022-12-06 17:00:09,0,0,370
2642,📢📢 Внимание! В с.Вешкелица бегает собачка черная со шлейкой! Возможно сбежала от хозяев. Большая просьба хозяевам найтись!!!,2022-12-06 11:42:05,20,6,697
2641,#МБУэтнокультурныйцентрВешкелюс,2022-12-06 09:41:08,26,2,428
2639,"Дорогие односельчане! Приглашаем вас 07 декабря в 17.00 в этноцентр на встречу с отцом Вячеславом, Настоятелем храма Рождества Христова г.Суоярви.",2022-12-05 15:23:33,30,2,553
2638,"Дорогие односельчане!         04 декабря православные верующие отмечают праздник Введение во храм Пресвятой Богородицы.        Согласно преданию, матери Девы Марии незадолго до зачатия явился ангел, который сообщил о скором рождении ребенка. Женщина пообещала, что ребенок, какого бы пола он ни был, будет служить Господу, поэтому в три года Марию отдали жить в храм.  Первосвященник, принимавший Марию, тоже получил наставление свыше и ввел девочку в Святая святых, где хранились скрижали Завета. До этого в помещение никогда не было разрешено входить кому-либо, кроме самого первосвященника — раз в год он совершал там очистительный ритуал.  При храме Мария жила до замужества — по указанию ангела священник по имени Захария устроил смотр женихов, выбирая суженого при помощи посоха, который расцвел, оказавшись рядом с Иосифом.  Что можно делать 4 декабря  Введение было принято считать началом зимы — поэтому праздник был своего рода отмашкой для зимних ярмарок. 4 декабря считается хорошим днем для совершения сделок, продажи или обмена.  На Руси верили, что в этот день Зима разъезжает на санях от деревни к деревне — поэтому ко Введению принято было приводить в порядок и усовершенствовать сани, чтобы Зима могла при необходимости взять любые. В современных условиях в этот праздник также хорошо будет заняться проверкой и приведением в порядок любого личного транспорта.  Что нельзя делать 4 декабря  Поскольку Введение Богородицы во храм — большой религиозный праздник, на Руси категорически запрещали заниматься в этот день тяжелым трудом. По возможности свободное время необходимо посвятить мыслям о жизни и молитвам.  Нельзя 4 декабря суетиться, торопиться и спешить. Считается, что тот, кто Зиму впопыхах встречает — весь год будет спешить, но не успеет.  Ни в коем случае не стоит давать кому-либо в долг — на Руси верили, что это сулит убытки и бедность в ближайшие месяцы, пишет ytro.news.  Приметы 4 декабря  Если снег выпал на Введение и не растаял до тепла, то будет хороший урожай. Если в этот день выпало много снега, зима будет снежной и морозной. Если в эту дату на улице сильный мороз, то лето будет жарким и засушливым, а в ближайшие дни будет стужа.",2022-12-03 08:28:05,14,0,441
2637,03 декабря  с 22:00  до  01:15 Д И С К О Т Е К А цена билета: 100 руб.,2022-12-02 13:39:55,9,9,465
2636,"Продолжается голосование за выбор названия нового Российского движения детей и молодежи.  На выбор предлагается 10 вариантов названий, предложенных детьми и отобранных экспертами по итогам всероссийского конкурса соавторов РДДМ: «Российское движение детей и молодежи», «Движение школьников и молодежи», «Движение им. Гагарина», «Пионеры», «Новое поколение», «Юность», «Патриоты», «Будущее России», «Юная Россия» и «Большая перемена».  До 3 декабря каждый желающий сможет принять участие и отдать свой голос за наиболее понравившееся название с помощью специального чат-бота: https://vk.cc/ciReEN  #МБУэтнокультурныйцентрВешкелюс",2022-12-02 10:36:07,1,0,370
2634,https://vk.com/wall44636242_3115,2022-12-01 09:49:46,0,0,304
2632,"Центр народного творчества приглашает на театрализованное шоу с Дедушкой Морозом «Говорят, под Новый год…Перезагрузка»  Интерактивная программа пройдет с 18 по 30 декабря 2022 года в Большом зале Центра народного творчества и культурных инициатив Республики Карелия. Программа рассчитана на группы до 40 человек.  Телефон для справок и бронирования: 55-95-00 (добавочный 104).  #МБУэтнокультурныйцентрВешкелюс",2022-11-29 13:15:27,3,1,439
2629,"Праздничный концерт ""Весь мир начинается с мамы..."" Огромная благодарность всем участникам концерта и дорогому зрителю. С праздником!",2022-11-27 18:02:54,78,1,598
2627,"🔊🔊Дорогие односельчане! Приглашаем вас принять участие в сборе помощи для добровольцев и мобилизованных ребят носков, рукавиц, перчаток. Теплые вещи можно приносить в сельскую библиотеку с 12:00 до 15:30 в рабочие дни.  Собранные вещи будут отвозиться в пункт сбора помощи добровольцев и мобилизованных.",2022-11-27 11:35:01,31,3,819
2624,"Национальная театральная школа — это трехдневный образовательный интенсив. Успешное прохождение интенсива подтверждается получением свидетельства государственного образца о повышении квалификации от СПбГУ по программе «Основы менеджмента в современном национальном театре».  В программе: 🔹 основы менеджмента 🔹 проектное управление 🔹 фандрайзинг 🔹 проектирование и продвижение театральных проектов 🔹 проблемы современного театрального процесса 🔹 работа в командах над проектами  Участниками проекта могут стать граждане в возрасте от 18 до 35 лет, которые: — работают в театре — работают в ином учреждении культуры и искусства, но хотели бы работать в театре — занимаются творческой или проектной деятельностью, связанной с театром  Заявки на участие принимаются до 29 ноября по адресу электронной почты проекта:  📩 nts.otbor.karelia@mail.ru.  Отбор резидентов проводит Министерство культуры Республики Карелия. Из всех претендентов будут отобраны 35 участников. Подтверждение о прохождении отбора и зачислении на программу будет направлено участникам на электронную почту, указанную при заполнении заявки.  #МБУэтнокультурныйцентрВешкелюс",2022-11-25 16:08:08,1,0,373
