topic,text,date,domain,type_group
язык,"Вторым словарем вепсского языка стал «VEPSA-VENӒHINE VAJEHNIK» (Вепсско-русский словарь), изданный в 1936 году под авторством М.М. Хямяляйнена и Ф.А. Андреева.   «Данный словарь выпускается в целях оказания помощи работникам, работающим на родном языке, в целях приближения вепсских наречий к литературному языку. Словарь выпускается также в целях оказания помощи в изучении русского языка вепсами.   Слова даны в форме литературного языка, но в словарь вошли далеко не все слова, которые бытуют в вепсском языке..», - обращаются авторы словаря к читателям.   Сегодня у вас есть возможность ближе познакомиться с этим словарем.",2020-04-17 17:20:00,desyatiletieyazykovkarelia,language
язык,Kucummo vastavundah Karjalan kirjuttajan Jana Zemoiteliten kel. Häi kirjuttau ylen hyvii kniigoi meijän elaigah näh. Vie ehtittö lugie enne vastavundua Ei loiton ruajuspäi- kniigan.,2016-03-27 21:25:20,karjalankielenkodi,multifunctional
язык,"Täs on kirjutettu vieljärveläzihgi nähte. Sana on sulavu dai vägevy. Vägevy kui vezi. Hyviä lugemistu joudoaijakse! В статье федерального интернет-издания упоминаются жители Ведлозера. Например, 90-летняя Иванова Мария Ильинична. https://www.severreal.org/a/30564420.html",2020-05-03 17:09:59,karjalankielenkodi,multifunctional
язык,"💢 LIVVINKARJALA 💢 ЛИВВИКОВСКИЙ 💢СЛОВО № 1⃣9⃣ ČUAJU    ✍🏻 EZIMERKI | ПРИМЕР    Пример со словом ČUAJU:  💢ČUAJUU ZUAHARII!💢    🙇‍♂Прослушайте пример, повторите за диктором и попробуйте перевести на русский язык! Cделайте репост и напишите перевод на своей стене.  Можете также придумать свой пример с этим словом и опубликовать его на своей стене, поставив хештег #100sanaa или #100словокарелии    💫Правильный ответ опубликуем в конце недели.    🎁Cамый активный участник группы в конце месяца получит подарок от команды проекта!    👩‍🦰Пример читает Элина Потапова из [club17159843|""Oma Mua""] — еженедельной газеты на карельском языке.    #100словокарелии #100sanaa #karjala #karjala100 #livvinkarjala #karjalan_kieli #omamua #kielikeskus #omamua",2020-03-16 13:09:04,satasanaa,language
язык,"💢 VEPSÄN KEL' 💢 ВЕПССКИЙ 💢СЛОВО № 4⃣2⃣ ✍🏻 OZUTEZ | ПРИМЕР    Пример со словом VEZILANKTUZ 💢KARJALAS OM KIVAČ-VEZILANKTUZ💢    🙇‍♂Прослушайте пример, повторите за диктором и попробуйте перевести на русский язык! Cделайте репост и напишите перевод на своей стене.  Можете также придумать свой пример с этим словом и опубликовать его на своей стене, поставив хештег #100sanaa или #100словокарелии    💫Правильный ответ опубликуем в конце недели.    🎁Cамый активный участник группы в конце месяца получит подарок от команды проекта!    👩‍🦱Пример читает [id1459265|Александра Анискина] – актриса Национального театра Карелии .    #100словокарелии #100sanaa #karjala #karjala100 #vepsän_kel #вепсский #kielikeskus #kodima",2020-06-05 14:09:00,satasanaa,language
язык,Karjalainen nuorisoliitto http://www.karjalainennuorisoliitto.fi/ (Карельский союз молодёжи). Feisbuukissa / В Фейсбуке https://www.facebook.com/karjalainennuorisoliitto/,2016-11-03 14:33:11,karelian_speakers,multifunctional
язык,"👩‍🎓А знаете ли Вы что...  ✨Вепсское слово lipikaine (бабочка) имеет древнее финно-угорское происхождение, аналогичные термины для обозначения этого насекомого встречаются в финском (liippo, liipukka), карельском (liipoi, liipak), эстонском (liblik, lible) язках.   🦋По мнению этимологов, это слово дескриптивное, изображающее характерную черту полета бабочки – хлопанье крыльями.  #Вепсы_Карелии",2020-06-12 15:09:00,desyatiletieyazykovkarelia,language
язык,"💢 SUOMEN KIELI 💢 ФИНСКИЙ ЯЗЫК 💢СЛОВО № 3⃣6⃣ ✍🏻 ESIMERKKI | ПРИМЕР    Пример со словом TEERI 💢TEEREN RAVINTO KOOSTUU VERSOISTA, SILMUISTA, LEHDISTÄ, RUOHOISTA JA MARJOISTA.💢    🙇‍♂Прослушайте пример, повторите за диктором и попробуйте перевести на русский язык! Cделайте репост и напишите перевод на своей стене.  Можете также придумать свой пример с этим словом и опубликовать его на своей стене, поставив хештег #100sanaa или #100словокарелии    💫Правильный ответ опубликуем в конце недели.    🎁Cамый активный участник группы в конце месяца получит подарок от команды проекта!    👱‍♀Пример читает Инна Нипполайнен из Ресурсного языкового медиацентра карелов, вепсов и финнов Республики Карелия.    #100словокарелии #100sanaa #karjala #karjala100 #suomen_kieli #kielikeskus #karjalansanomat",2020-05-14 17:18:00,satasanaa,language
язык,"Небольшой комментарий об итогах Марафона записей вепсской и карельской речи прозвучал сегодня в выпуске новостей [club89004728|Karjalan radio 102,2FM. Kodirandaine] на людиковском наречии карельского языка.",2023-10-12 18:39:34,speechvepkar,language
язык,"💢 SUOMEN KIELI 💢 ФИНСКИЙ ЯЗЫК 💢СЛОВО №9⃣5⃣ ✍🏻 ESIMERKKI | ПРИМЕР  Пример со словом REVONTULET 💢REVONTULTA SEN TALVIEN TAIVAS LUO, KUN PAKKANEN PARHAANA RÄISKÄÄ.💢  🙇‍♂Прослушай пример, повтори за диктором и попробуй перевести на русский язык! Cделай репост и напиши перевод на своей стене. Можешь также придумать свой пример с этим словом и опубликовать его на своей стене, поставив хештег #100sanaa или #100словокарелии  💫Правильный ответ опубликуем в конце недели.  🎁Cамый активный участник группы в конце месяца получит подарок от команды проекта!  👱‍♀Пример читает Наталья Денисова из Ресурсного языкового медиацентра карелов, вепсов и финнов Республики Карелия.  #100словокарелии #100sanaa #karjala #karjala100 #suomen_kieli #kielikeskus",2020-12-04 11:00:03,satasanaa,language
язык,"Pruazniekan aigah gost'at syödih magien suupan. Suuret passibot suupan keittäjile - Borovikan Annile, Polevajan Nataljale da Rybnikovan Marinale! Da abuniekoile - Ivanovan Vera Dmirjijevnale da Nikolajevan Aleksandrale. Tervehytty da kaikkie hyviä!",2018-08-02 18:45:12,karjalankielenkodi,multifunctional
язык,"💢 SUOMEN KIELI 💢 ФИНСКИЙ ЯЗЫК 💢СЛОВО № 9⃣2⃣ ✍🏻 ESIMERKKI | ПРИМЕР    Пример со словом ILVES 💢ILVEKSELLÄ ON TUPSUKORVAT, KIRJAVA TURKKI JA ISOT TASSUT.💢    🙇‍♂Прослушай пример, повтори за диктором и попробуй перевести на русский язык! Cделай репост и напиши перевод на своей стене.  Можешь также придумать свой пример с этим словом и опубликовать его на своей стене, поставив хештег #100sanaa или #100словокарелии    💫Правильный ответ опубликуем в конце недели.    🎁Cамый активный участник группы в конце месяца получит подарок от команды проекта!    👱‍♀Пример читает Инна Нипполайнен из Ресурсного языкового медиацентра карелов, вепсов и финнов Республики Карелия.    #100словокарелии #100sanaa #karjala #karjala100 #suomen_kieli #kielikeskus",2020-11-24 13:00:03,satasanaa,language
язык,"💢 SUOMEN KIELI 💢 ФИНСКИЙ ЯЗЫК 💢СЛОВО № 9⃣4⃣ ✍🏻 ESIMERKKI | ПРИМЕР    Пример со словом LUMI 💢MARRASKUUSSA LUMI SATAA USEIN, MUTTA SULAA NOPEASTI.💢    🙇‍♂Прослушай пример, повтори за диктором и попробуй перевести на русский язык! Cделай репост и напиши перевод на своей стене.  Можешь также придумать свой пример с этим словом и опубликовать его на своей стене, поставив хештег #100sanaa или #100словокарелии    💫Правильный ответ опубликуем в конце недели.    🎁Cамый активный участник группы в конце месяца получит подарок от команды проекта!    👱‍♀Пример читает Наталья Денисова из Ресурсного языкового медиацентра карелов, вепсов и финнов Республики Карелия.    #100словокарелии #100sanaa #karjala #karjala100 #suomen_kieli #kielikeskus",2020-12-02 13:00:08,satasanaa,language
язык,"Тексты на карельском язык с переводом на русский. Собственно карельское наречие - Толмачевский говор.  Источники:   Культура повседневности карельской семьи (конец XIX - первая треть ХХ в.), (2014). Новак И.П., Тверские диалекты карельского языка: Фонетика. Фонология, (2016). Г.Н. Макаров, Образцы карельской речи. Калининские говоры, (1963).",2021-01-05 11:00:00,learning_karelian_language,language
язык,"💢 SUOMEN KIELI 💢 ФИНСКИЙ ЯЗЫК 💢СЛОВО № 5⃣ METSÄ ✍🏻 ESIMERKKI | ПРИМЕР    Пример со словом METSÄ:  💢RESIDENSSI SIJAITSEE KAUNIISSA METSÄSSÄ. 💢    🙇‍♂Прослушайте пример, повторите за диктором и попробуйте перевести на русский язык! Cделайте репост и напишите перевод на своей стене.  Можете также придумать свой пример с этим словом и опубликовать его на своей стене, поставив хештег #100sanaa или #100словокарелии    💫Правильный ответ опубликуем в конце недели.    🎁Cамый активный участник группы в конце месяца получит подарок от команды проекта!    👱‍♀Пример читает Маргарита Пехконен из [club17311996|Karjalan Sanomat] - газеты на финском языке, которая выходит в Петрозаводске раз в неделю.    #100словокарелии #100sanaa #karjala #karjala100 #suomen_kieli #kielikeskus #karjalansanomat",2020-01-29 14:39:00,satasanaa,language
язык,"📝 Диктант на собственно карельском наречии карельского языка написали вчера в п. Пяозерский [club52127733|в этнокультурном центре ""Карельская изба""]!   Piäjärvellä pitimä sanelun karjalan kielellä, oli 8 henkie, +vetäjä Anni Vlasova; oli 4 koululaisie, lisäksi 2 h.- onlain. Meilä kaikki oltih aloittajat, sen takie teksti ""Turvakko"" näytti oikein vaikiena.Mie iče kirjutin Televizorin peräššä, ni juuri kerkesin kaikkie kirjuttua. Piätin kirjuttuua sanelua vanhalla tekstilla - Tuaton koivu. Se oli meilä sopiva. Tärkie on osallistua.Kerroin Kiestinkin kansanlauluja - kirjasta, oli mielenkiintoista. Vlasova Vieno ta muut karjalaseuran jäsenet suatih kirjat lahjaksi.  #karjalankielennedäli #karjalankielennetäli",2020-11-11 9:38:56,desyatiletieyazykovkarelia,language
язык,"💢 VIENANKARJALA 💢 СОБСТВЕННО КАРЕЛЬСКИЙ 💢СЛОВО № 6⃣0⃣  ✍🏻 ESIMERKKI | ПРИМЕР    Пример со словом MESI 💢TULOU MESI RUOKAH .💢    🙇‍♂Прослушайте пример, повторите за диктором и попробуйте перевести на русский язык! Cделайте репост и напишите перевод на своей стене.  Можете также придумать свой пример с этим словом и опубликовать его на своей стене, поставив хештег #100sanaa или #100словокарелии    💫Правильный ответ опубликуем в конце недели.    🎁Cамый активный участник группы в конце месяца получит подарок от команды проекта!    🧒Пример читает Мария Спицына из ""Oma Mua"" — газеты на карельском языке, которая выходит раз в неделю в Петрозаводске.    #100словокарелии #100sanaa #karjala #karjala100 #vienankarjala #karjalan_kieli #omamua #kielikeskus",2020-08-03 14:00:09,satasanaa,language
язык,"💢 LIVVINKARJALA 💢 ЛИВВИКОВСКИЙ 💢СЛОВО № 9⃣3⃣ ✍🏻 EZIMERKI | ПРИМЕР    Пример со словом PEDRU 💢SANOTTIH, OLI MEIJÄN GI MEČIS PEDRUA.💢    🙇‍♂Прослушай пример, повтори за диктором и попробуй перевести на русский язык! Cделай репост и напиши перевод на своей стене.  Можешь также придумать свой пример с этим словом и опубликовать его на своей стене, поставив хештег #100sanaa или #100словокарелии    💫Правильный ответ опубликуем в конце недели.    🎁Cамый активный участник группы в конце месяца получит подарок от команды проекта!    👩‍🦰Пример читает Элина Потапова - из ""Oma Mua"" — газеты на карельском языке, которая выходит раз в неделю в Петрозаводске.    #100словокарелии #100sanaa #karjala #karjala100 #livvinkarjala #karjalan_kieli #omamua #kielikeskus #omamua",2020-11-25 12:00:12,satasanaa,language
язык,"💢 LIVVINKARJALA 💢 ЛИВВИКОВСКИЙ 💢СЛОВО № 6⃣ 1⃣ ✍🏻 EZIMERKI | ПРИМЕР    Пример со словом VUARU 💢 VUARU ON MÄGIE MADALEMBI.💢    🙇‍♂Прослушай пример, повтори за диктором и попробуй перевести на русский язык! Cделай репост и напиши перевод на своей стене.  Можешь также придумать свой пример с этим словом и опубликовать его на своей стене, поставив хештег #100sanaa или #100словокарелии    💫Правильный ответ опубликуем в конце недели.    🎁Cамый активный участник группы в конце месяца получит подарок от команды проекта!    👩‍🦰Пример читает Наталья Синицкая - генеральный директор издательства ""Периодика"".    #100словокарелии #100sanaa #karjala #karjala100 #livvinkarjala #karjalan_kieli #omamua #kielikeskus #omamua",2020-08-05 12:00:08,satasanaa,language
язык,METSÄMANSIKKA - ЗЕМЛЯНИКА  Хороший способ закреплять новые слова - это произносить их и использовать в жизни! Как делает это Даниил Ульянов ) Берите пример и присылайте нам своё видео в личные сообщения или размещайте на своей страничке с хештегом #100sanaa!  #100sanaa #suomenkieli,2020-06-30 19:26:00,satasanaa,language
язык,"💢 VEPSÄN KEL' 💢 ВЕПССКИЙ 💢СЛОВО № 🔟 LIDN   ✍🏻 OZUTEZ | ПРИМЕР    Пример со словом LIDN:  💢MINUN SEBRANIK RADAB LIDNAS.💢    🙇‍♂Прослушайте пример, повторите за диктором и попробуйте перевести на русский язык! Cделайте репост и напишите перевод на своей стене.  Можете также придумать свой пример с этим словом и опубликовать его на своей стене, поставив хештег #100sanaa или #100словокарелии    💫Правильный ответ опубликуем в конце недели.    🎁Cамый активный участник группы в конце месяца получит подарок от команды проекта!    👩‍🦱Пример читает Дарья Швецова из [club54326264|""KODIMA""] — газеты на вепсском и русском языке, которая выходит раз в месяц в Петрозаводске.    #100словокарелии #100sanaa #karjala #karjala100 #vepsän_kel #вепсский #kielikeskus #kodima",2020-02-13 13:22:00,satasanaa,language
язык,"СЛОВО № 8⃣8⃣ KODI / KOTI   Восемьдесят восьмое слово о Карелии – ДОМ   В русском языке слово дом обозначает и строение, и родной очаг. В карельском, вепсском и финском для этих понятий есть разные слова. Слово koti/kodi означает место, где вы живете, где горит огонь в печи, где вы чувствуете себя в безопасности.   💢Ливвиковский карельский (livvinkarjala): KODI   💢Собственно карельский (vienankarjala): KOTI   💢Людиковский (lyydi): KODI   💢Вепсский (vepsän kel´): KODI   💢Финский (suomi): KOTI   🙇‍♂Повторяйте за дикторами, тренируйте произношение!    ❤Предлагайте свои любимые слова о Карелии:  ✏В теме обсуждения по ссылке: https://vk.com/topic-190681663_41596124  📹 Снимайте видеоролики и присылайте в личные сообщения группы или выкладывайте у себя на странице с хештэгом #100sanaa.    🎨Иллюстрация к слову ""Дом"" - Дмитрий Дмитриев.    #100словокарелии #100sanaa #karjala #karjala100 #karjalan_kieli #suomen_kieli #vepsän_kel #kielikeskus",2020-11-09 11:00:10,satasanaa,language
язык,"💢 SUOMEN KIELI 💢 ФИНСКИЙ ЯЗЫК 💢СЛОВО № 3⃣9⃣ ✍🏻 ESIMERKKI | ПРИМЕР    Пример со словом HYTTYNEN 💢 HYTTYSET OVAT MONIEN LINTUJEN, HÄMÄHÄKKIEN JA SAMMAKOIDEN RAVINTOA.💢    🙇‍♂Прослушайте пример, повторите за диктором и попробуйте перевести на русский язык! Cделайте репост и напишите перевод на своей стене.  Можете также придумать свой пример с этим словом и опубликовать его на своей стене, поставив хештег #100sanaa или #100словокарелии    💫Правильный ответ опубликуем в конце недели.    🎁Cамый активный участник группы в конце месяца получит подарок от команды проекта!    👱‍♀Пример читает Инна Нипполайнен из Ресурсного языкового медиацентра карелов, вепсов и финнов Республики Карелия.    #100словокарелии #100sanaa #karjala #karjala100 #suomen_kieli #kielikeskus #karjalansanomat",2020-05-26 17:10:28,satasanaa,language
язык,"TÄL NEDÄLIL MEDIAKESKUKSES /  НА ЭТОЙ НЕДЕЛЕ В РЕСУРСНОМ ЦЕНТРЕ   📖 10.05 – kolmaspäivy / среда  17:30 – Вепсский язык (преподаватель Г.С. Бабурова); 18:00 – Карельский язык - онлайн  (собственно карельское наречие, преподаватель У.М. Тикканен)    📖 11.05 – nelläspäivy / четверг 17:00 – Детская развивающая группа Kičči-kočči  (А.О. Картынен, М.А. Туккия);  18:00 – Вепсский язык (преподаватель М.М. Шашина); 18:30 – Финский язык  (бесплатная группа, преподаватель Т.А. Морозова)   📖 13.05 – suovattu / суббота  10:00, 12:00 – Финский язык  (платные группы, преподаватель Т.А. Морозова);  12:00, 13:30 – Карельский язык  (людиковское наречие, преподаватель М.А. Кочерина)   #aikataulu #kielikeskus #tapahtumat #petroskoi #karjala #ptz #karjalan_kieli #livvin_karjala #vepsänkel #suomen_kieli",2023-05-10 12:57:33,mediacenter_periodika,multifunctional
