topic,text,date,domain,type_group
литература,"Я напишу тебе письмо  Я напишу тебе письмо… В почтовый ящик, по-старинке, с звездою, восемь шесть перо, смахну из глаз слезу-соринку.  Я напишу: «Привет, родной! Сдуваю я с тебя пылинки, сегодня дождик – выходной, я молоко напарю в кринке.  Заправлю углем самовар… Ну, что сидишь, налей погуще. А для разминки «Солнцедар»… Затем, как раньше, сходим в кущи»  Но нет конверта, где перо? И нету адреса былинки… Что, старый, в сказку повело? Печь затопи, щепай лучинки.  Вари картошку, фармазон. Она любила. (Для поминки) Закончить гамму? Не резон, судьбы не кончены ужимки.  13.07.19   фото из интернета",2019-07-13 9:14:13,domderevnivoknavolok,museum
традиции и фольклор,"📷 Retro Поморы на дореволюционных снимках  □□□□□□□□□□□□□□□□□□□□□□□□□□□□□□□□□□□□□□□□□□□□□□□□□□□□□□□□□□□□ Поморы на промысле  Автор съёмки: Лейцингер, Яков Иванович  Время съёмки: 2012",2017-02-24 12:37:58,karel_colorit,multifunctional
традиции и фольклор,"⃣ Поморские пословицы и поговорки  • • • • • • • • • • • • • • • • • • • • • • • • • • • • • • • • • • • • • • • • • • • • • • • • • • • • • • • • • • • • • • • • • • •  Говорят: «Нюхчане — те же англичане, только наречие иначе».  Так можно сказать и о других жителях Карельского Поморья, в речи  которых сохранились архаические черты новгородского и ростово- суздальского диалектов, а также отразились контакты русских с  карелами, вепсами, саамами, ненцами.   ☞ У нас хлеб едят не с поля, а с моря.  ☞ Кто на море не бывал, тот и горя не видал, а кто побудет, тот  никогда не забудет.  ☞ Море скачет, море пляшет, море денежку даёт.  ☞ Кто на море не бывал, тот от ретива сердца Богу не маливался  ☞ Мурман — кому мать, кому мачеха.  ☞ Море — наше поле, даст Бог рыбу — даст Бог и хлеб.  ════════════════════════════════════════════════════",2018-02-12 10:52:52,karel_colorit,multifunctional
образование,"✏ПО ОБМЕНУ ОПЫТОМ ПРОЕКТНОЙ ДЕЯТЕЛЬНОСТИ В СФЕРЕ КУЛЬТУРЫ  Сегодня, 22 сентября, в зале [https://vk.com/rk_nationalmuseum|Национального музея Карелии] состоялось открытие курсов повышения квалификации для директоров учреждений культуры «Проектная деятельность в сфере культуры и искусства».    Участниками обучающей программы стали более двадцати руководителей культурно-образовательных организаций Ленинградской области.    На открытии с концертными номерами выступил музыкант Радис Гайниятов. Он продемонстрировал гостям республики звучание традиционных музыкальных инструментов и исполнил ёйгу на карельском языке.    Заместитель директора Центра народного творчества и культурных инициатив Карелии Татьяна Леднева приветствовала участников съезда. В своем докладе Татьяна Александровна рассказала о Центре, его истории, о методической работе подразделений и особенностях их функционирования в структуре, а также осветила проектную деятельность организации.    Цикл образовательных мероприятий для руководителей учреждений культуры продлится до 25 сентября. Своим опытом работы с участниками поделятся профессионалы и квалифицированные специалисты в области культуры Республики Карелия.    Организаторами обучающей программы выступают [https://vk.com/dntlenobl|Дом народного творчества Ленинградской области] совместно с Центром национальных культур и народного творчества Карелии.",2022-09-22 16:55:00,etnodomrk,festival
образование,А мы готовимся и ждём всех завтра на увлекательное мероприятие «Калевальские мотивы»!  Начинаем с 11:00 и весело и познавательно проводим время до 14:00. А в 14:00 награждаем самых самых))))  Будет здорово!   #национальныймузейкарелии #калевальскиемотивы #акции_нмрк,2019-02-15 18:05:37,rk_nationalmuseum,museum
образование,"🏛На выходных можно отлично провести время всей семьей  в Национальном музее Карелии:  🔸7 августа в 12:00 прийти с детьми на тематическое занятие «Петрозаводский почтальон» / билет - 100 рублей. 🔸8 августа в 12:00 посетить интерактивное занятие «Карельский язык» / билет -100 рублей. 🔸В субботу и воскресенье в 15:00 совершить путешествие по музею, посетив «Экскурсионную мозаику» / билет - 350 рублей. 🔸Посмотреть наши временные выставки «Eta Pravda vsjо byla. Истории легендарной фолк-группы Мюллярит» и «Тот самый длинный день в году…», посвящённую событиям 22 июня 1941 года. 🔸Вместе с детьми посетить музейное пространство «Удивительный мир животных» 🔸Неспешно пройтись по нашей постоянной экспозиции 🔸Купить на память сувенир в музейном магазине  Вдохновение и настроение гарантируем, а также укрепление семейных традиций!  Работаем для вас с 11:00-19.00. Касса закрывается в 18:30.  #выставки_нмрк #национальныймузейкарелии #nmrk #всевмузей #карелия #историякарелии  #фондынмрк #чтопосмотретьвпетрозаводске #ялюблюэтотвашпетрозаводск ________________________  🏛 пл. Ленина,1  ☎ (814-2)55-96-20 🌎http://nmrk.karelia.ru/  ✉infokgkm@yandex.ru",2021-08-07 10:03:45,rk_nationalmuseum,museum
образование,"Новостной видеосюжет о прошедшей интерактивной встрече ""А как это будет по-карельски?"", которая прошла в ресурсном центре 12 апреля с педагогом и редактором газеты ""Oma Mua"" [id21755123|Ульяной Тикканен]👏🏻👏🏻👏🏻  Karjalas jatkuu karjalan kielen nedäli. Joga päiviä Karjalan linnois da kylis pietäh ozutteluloi, vastavuksii, luvendoloi karjalan kieleh näh 📗    Kyzymykseh ""Mitein še on karjalakši?"" vastattih rahvas, ket tuldih interaktiivizeh vastavukseh Resursumediakeskukseh Petroskoil. Hyö opastuttih pienii virkehii da opittih paista vienakse. Opastumah vienua kävyi meijän toimittaigi Anna Turkina.",2022-04-15 14:55:52,mediacenter_periodika,multifunctional
образование,"🗯29 февраля в 17.00 в [club791498|Национальном музее Карелии] состоится интеллектуально-развлекательная игра «Калевальский квиз»    🗣Мы предлагаем вам окунуться в мир традиционной культуры, музейных предметов и загадочной «Калевалы». Если вы знакомы с поэмой «Калевала» - это ваше преимущество, если вы не читали эту книгу, наша игра - прекрасный способ чуть больше узнать о героях древних сказаний, культуре и обычаях наших предков.    Вас ждут 6 туров, в каждом - 5 вопросов. Помимо традиционных, мы так же приготовили для вас туры-сюрпризы: «Черный ящик» и «Экспотур».    Хотите стать участником нашей игры? Собирайте команду (от 3 до 6 человек) и подавайте заявку в личные сообщения группы (название команды и количество человек).    Если команды нет- не беда! Сообщите нам о своем желании играть! Если таких желающих будет много, тогда получится настоящая сборная!    💥Стоимость участия - 100 руб./чел    Остерегайтесь мошенников - билеты приобретаются только в кассе музея!    #национальныймузейкареии #акции_нмрк #калевала",2020-02-19 15:30:03,rk_nationalmuseum,museum
образование,"Познакомьтесь: ПостНаука — ресурс о современной фундаментальной науке и ученых, которые ее создают.  Ресурс ориентирован на самую широкую аудиторию и с радостью делится видео и текстами с блогерами, новостными медиа, некоммерческими организациями и пользователями социальных сетей на безвозмездной основе, и с коммерческими компаниями на удобных партнерских условиях.    Сейчас команда ПостНауки начинает работу над огромным проектом о языках России — и вы можете им помочь.  💥Нужны люди, говорящие в том числе и на карельском языке! 💥  Читайте подробности о проекте: https://postnauka.ru/blog/155325",2020-07-14 10:18:18,mediacenter_periodika,multifunctional
образование,"Petroskoin yliopiston opastujat tutkitah Vieljärven kielipezän ruandua. Kezäl Filolougien instituutan piästökäs Veronika Bogdanova puolisti kahten vuvven tutkinduruavon meijän N`apukat-kielipezän dielos. Tuli ynnälline diplom. Meil se on ylen tärgei. Tiijonkandastu tieduo pidäy olla vältämättäh, ku eistiä dieluo edehpäi. Veronika andoi luvan panna diploman KKK:n sivustol. Diploman syväindö pohjavuu yliopastujan paginoih kielipezän ruadajinke, käyndöih kielipezäh da kačondoih, yhtesolendoih lapsienke da ruadajinke, jullattuh literatuurah da mediah, kyzelendylistoih (vahnembat, ruadajat).  Итоги двухлетнего исследования студентки Института филологии ПетрГУ (кафедра прибалтийско-финских языков) Вероники Богдановой языкового гнезда в селе Ведлозеро вошли в выпускной диплом по теме ""Языковое гнездо как среда усвоения и функционирования карельского языка"", который она защитила летом этого года. С разрешения Вероники размещаем работу, в которой представлен теоретический блок с опорой на научную литературу, описана практика, основанная на общении с сотрудниками языкового гнезда и личном посещении студентки гнезда, мониторингах и опросах, в которых участвовали также родители детей. Для Дома Карельского Языка интерес к такой теме и наличие целой дипломной работы очень важны. ПОЯВИЛСЯ ЕЩЕ ОДИН МАТЕРИАЛ С ОПОРОЙ НА ПРАКТИКУ О ЯЗЫКОВОМ ГНЕЗДЕ. Поскольку их не так много, каждый представляет большую ценность.",2021-11-25 17:02:21,karjalankielenkodi,multifunctional
образование,"Минфин Карелии внес соответствующие изменения в республиканский бюджет с целью организации дополнительных мест в дошкольных образовательных учреждениях. Для решения данной задачи республикой подписано соглашение с Министерством образования и науки РФ о предоставлении финансовой помощи из федерального бюджета. На обеспечение доступного и качественного образования в регионе, в том числе – на создание дополнительных дошкольных мест для детей от 2-х месяцев до 3-х лет предусмотрены значительные объемы средств: на 2018 год - 158,6 млн. рублей (из них средства федерального бюджета – 149,1 млн. рублей, республиканского бюджета– 9,5 млн. рублей), на 2019 год – 348,9 млн. руб. (фед. – 328 млн. руб., респ .– 20,9 млн. руб.). Это позволит создать в Карелии 776 дополнительных дошкольных мест для детей.",2018-08-14 17:48:43,aparfenchikov,state
образование,"💫 В Республике Карелия в рамках Года карельских рун 24-25 сентября 2021 года состоится Семинар-практикум, посвященный карельской рунопевческой традиции и эпическому наследию коренных народов Севера.  Работа семинара будет посвящена: - вопросам сохранения, развития и популяризации карельской рунопевческой традиции, создания на основе карельских рун новых этнокультурных продуктов;  - знакомству с эпическим наследием коренных народов Севера;  - позитивному опыту просветительской деятельности в части рунопевческой традиции, погружения в традицию с помощью обучения пониманию и исполнению текстов калевальской метрики.   Приглашаем принять участие в семинаре с докладами представителей научного сообщества, образовательных организаций и учреждений культуры, общественных объединений финно-угорских народов, органов государственной власти, органов местного самоуправления, а также средств массовой информации.   Заявку необходимо направить в срок до 6 сентября 2021 года по электронной почте: kielikeskus@rkperiodika.ru (с пометкой «Заявка на Семинар»). Оргкомитет оставляет за собой право отбора заявок. Информационное письмо и форму заявки вы найдете ниже.    Решение о формате проведения семинара будет приниматься исходя из ограничительных мер, действующих на территории Республики Карелия в связи с угрозой распространения новой коронавирусной инфекции.   Организаторами семинара выступают [club147415188|Министерство национальной политики Карелии], администрация Калевальского национального муниципального района, [club164550508|ПГК им. А. К. Глазунова], Институт языка, литературы и истории Карельского научного центра Российской Академии Наук, [club28399192|АУ РК «Издательство «Периодика»].  Дополнительную информацию о семинаре можно получить у организаторов по телефону 8 (8142) 78-03-15, контактное лицо – Андрей Николаевич Кузнецов, руководитель [club172096736|Ресурсный медиацентр карелов, вепсов и финнов].  #KarjalaisienRunojenVuosi #KarjalazienRunoloinVuozi #Kard’alaižiinRunoinVuoz’ #ГодКарельскихРун #КарельскиеСказители #руны",2021-08-09 17:32:00,desyatiletieyazykovkarelia,language
образование,"В пятницу ждем новых гостей!  Международный семинар «Культурно-историческое пространство карельской деревни как образовательный ресурс»  ПРОГРАММА  Дата проведения: 24 июня 2016 года Место проведения: д. Кинерма, с. Ведлозеро Пряжинского нац. муниципального района Участники семинара: учителя карельского языка, воспитатели ДОУ, обучающие детей карельскому языку, представители исполнительной власти и общественных организаций РК.   12.45-13.00 Выезд участников семинара из д. Кинерма в с. Ведлозеро Пряжинского национального муниципального района 13.00-14.30 Экскурсия по с. Ведлозеро,  Иванова Ольга Фёдоровна, зав. МДОУ  Детский сад «Линдуйне» с. Ведлозеро Пряжинского национального муниципального района 14.35-14.45 Экскурсия по Дому карельского языка.  Бармина Н.П., учитель карельского языка МКОУ «Крошнозерская школа-сад» Пряжинского национального муниципального района  14.45-15.15 Урок карельского языка по теме «Meijän kodi», Бармина Н.П.,учитель карельского языка МКОУ «Крошнозерская школа-сад» Пряжинского национального муниципального района   15.15-16.00 Занятие по теме «Национальные особенности карельского народного календаря»,  Конкка Алексей Петрович, ст. научный сотрудник сектора этнологии Институт языка, литературы и истории Карельского научного центра Российской академии наук (ИЯЛИ КарНЦРАН) 16.05-16.30 Мастер-класс «Изготовление ангелочков», Николаева Александра Ивановна, рук. кружка по рукоделию 16.35-17.00  Презентация сборника «Учебные материалы по карельскому языку» (автор Кондратьева С.Ф., учитель карельского языка МОУ ФУШ).  Подведение итогов семинара",2016-06-22 16:50:40,karjalankielenkodi,multifunctional
образование,УЧЕБНИКИ ПО ГЕОГРАФИИ ИЗДАННЫЕ ДО 1991 года.,2019-10-04 20:02:28,learning_karelian_language,language
образование,"✨В [club2883990|Петрозаводской детской школе искусств им. М.Балакирева] прошла Первая Открытая Республиканская краеведческая конференция учащихся «Культура. Традиции. Дети».   👩🏻‍🤝‍👨🏼Учащиеся детских школ искусств, домов творчества, общеобразовательных школ из Петрозаводска, Олонца, с. Михайловское, п. Пряжа с удовольствием рассказали о своих увлечениях, потрудились на мастер-классах, много общались и танцевали с участниками Заслуженного коллектива народного творчества Российской Федерации, Образцового коллектива художественного творчества Республики Карелия [club188071457|«Детский фольклорный ансамбль «Vesläžed»].  📚Министерство национальной и региональной политики предоставило книги дял участников конференции. #новости@minnazrk",2022-10-04 11:15:06,minnazrk,state
образование,"Сегодня 100-летний юбилей отмечает первая музыкальная школа Карелии – Детская музыкальная школа № 1 имени Гельмера Синисало!  Представляя первую ступень музыкального образования, школа ведет работу по сохранению и развитию уникальных традиций русского музыкального образования и дает талантливым детям прекрасную базу для дальнейшего творческого и профессионального развития. В каждого ученика вложен труд профессиональных педагогов, стремление к творческому поиску и самосовершенствованию.  Сердечно поздравляю всех, кто имеет отношение к старейшему образовательному учреждению, заслужившему непререкаемый авторитет в музыкальной и образовательной среде! Желаю коллективу школы, ученикам и выпускникам не останавливаться на достигнутом: смело смотрите в будущее, ставьте перед собой новые цели и стремитесь к прекрасному!",2018-11-24 19:43:55,aparfenchikov,state
