topic,text,date,domain,type_group
фестивали и конкурсы,"КОНКУРС ""ПОД СОУСОМ""  ФЕСТИВАЛЬ ""КУХНЯ НАРОДОВ КАРЕЛИИ""  РЕПОСТ РЕПОСТ РЕПОСТ ❤Приглашаем к участию в конкурсе молодых (а точнее любых) поваров и студентов по профессии! 💯Призовой фонд конкурса денежный: 50 тыс.руб за первое место, 30 тыс.руб за второе место и 20 тыс.руб за третье место (спонсор-ресторан ""ВКарелииЕсть""). 👍Цель конкурса благая: мотивация работы в профессии, обмен опытом, стимулирование развития в профессии, поднятие командного духа профессионального сообщества.  🍓А также конкурс поддержит местных производителей клубники, так как обязательным ингредиентом соуса должна быть местная клубника. ❗Описание проведения: участникам необходимо приготовить два соуса: соус для горячего блюда, соус для холодного блюда. В состав обоих соусов должен обязательно входить ингредиент - свежая клубника. Участники прорабатывают, как домашнее задание, рецепт 2-х соусов, а также готовят 100 мл каждого соуса для слепой дегустации жюри и приносят с собой на конкурс. Процедура слепой дегустации проводится сразу же после объявления конкурса открытым. Жюри используют бланки для оценки. Жюри удаляются для обсуждения. Предварительные победители уже определены. Затем конкурсанты готовят соуса за рабочими столами для дегустации гостями конкурса в объеме примерно 500 мл на каждый соус. Жюри наблюдают за процессом и возможно корректируют предварительные результаты. После окончания показательных выступлений поваров, гости дегустируют соус, жюри выносит окончательный вердикт о победителях. Затем следует процедура награждения. ⌛Время проведения: с 15 до 17 часов 8 июля Место проведения: набережная Онежжского озера, Петрозаводск, Шатер для мастер-классов  🤝Жюри конкурса: Председатель: Николай Семенов-шеф-повар ресторана уральской кухни ""Зверобой"", Екатеринбург. Является одним из основателей и шеф-поваров АУК-Аутентичная Уральская Кухня, проекта призванного возродить и объединить кухню Урала. Специализация: русская кухня, региональная кухня Урала, кухня нордик. Участник проекта ""русский завтрак"", эксперт арт-школы гастрономии образовательного заезда ""Только в России"" арт-кластера Таврида.  🇷🇺Зверобой — ресторан уральской региональной кухни. Работа в ресторане ведётся в трёх направлениях — восстановлении традиционных рецептов региона, использование техник приготовления присущих народам Урала, использование местных, локальных продуктов от производителей, поставщиков, охотничьих хозяйств по сезону. 👥Члены жюри: Галина Владимировна Бычкова Преподаватель высшей категории, Главный эксперт по компетенции Поварское дело Регионального конкурса Молодые Профессионалы, Главный эксперт на Демонстрационном экзамене в группах по профессии Повар, кондитер и по специальности: Поварское и кондитерское дело. Победитель Регионального конкурса Мастер Года и финалист Всероссийского конкурса Мастер Года 2021.Среди мастеров производственного обучения и преподавателей специального профессионального образования. Колледж технологии и предпринимательства Ольга Владимировна Иванова. Преподаватель, Главный эксперт по компетенции Поварское дело. Колледж технологии и предпринимательства. ✅Регистрация на конкурс: личным сообщением в WhatsApp +79212285888. При регистрации указать ФИО, место работы или учебы 💯#КухняНародовКарелии #ПодСоусом #КалиточныхДелМастер #МельницаСампо #СамыйСемейныйРыбник #КофейнаяКартаКарелии #КофейныйКружок",2023-07-04 12:52:37,tastykarjala,festival
фестивали и конкурсы,"📝 В преддверии Дня родного языка 21 февраля [club172096736|Ресурсный языковой центр карелов, вепсов и финнов Республики Карелия] запустил онлайн-конкурс знатоков карельского, вепсского и финского языков ""КарелиЯ - это Мы"".  К участию приглашаются жители Республики Карелия.    Отвечайте на вопросы по истории, этнографии карелов, вепсов и финнов, задания на знание грамматики и лексики карельского, вепсского и финского языков – соревнуйтесь за звание знатока!    Ответы принимаются до 23:00 (Мск) 17 февраля 2023 г.  Итоги конкурса будут подведены в группе организатора 21 февраля 2023 г.    Номинации:  📗 Знаток карельского языка и национальной культуры (ливвиковское наречие карельского языка): https://forms.gle/gn3mwvNg74SHXrTz5    📕 Знаток карельского языка и национальной культуры (собственно карельское наречие карельского языка): https://forms.gle/aMLykJM82DwocEyE6    📘 Знаток карельского языка и национальной культуры (людиковское наречие карельского языка): https://forms.gle/HTUzWEGXLFPsanp58    📙 Знаток вепсского языка и национальной культуры: https://forms.gle/jjBjTQZyiCytYDSc6    📒 Знаток финского языка и национальной культуры: https://forms.gle/UvTngVQPfDJskDbZ8    Для успешного перехода по ссылке можно скопировать её и вставить в адресную строку браузера.    Желаем удачи!",2023-02-12 13:53:18,desyatiletieyazykovkarelia,language
фестивали и конкурсы,"➡ [club147415188|Открыт прием заявок на всероссийский конкурс годовых отчетов НКО «Точка отсчета»]   На конкурс принимают годовые отчеты организаций за 2020 год. Заявку можно отправить через платформу form.donorsforum.ru до конца сентября. Найти подробную информацию можно на сайте Форума доноров по ссылке ⬇  📚 На общем конкурсе организациям присвоят «золотые», «серебряные», «бронзовые» и «базовые» стандарты отчетов. Кроме того, объявлено 8 партнерских номинаций.   Минэкономразвития наградит лучшие отчеты малых организаций (с бюджетом до 1 миллиона рублей), расположенных за пределами крупных городов. Фонд президентских грантов отметит отчеты организаций, которые активно работают с разными типами доноров и партнеров.    Агентство социальной информации выберет годовой отчет с лучшим текстом. Центр «Благосфера» определит отчет, который лучше рассказывает местным жителям о работе НКО. Будут отмечены НКО, которые активно включены в повестку устойчивого развития. С другими номинациями можно ознакомиться на сайте конкурса.  #НКОКарелии #поддержкаНКО",2021-09-11 12:00:01,minnazrk,state
фестивали и конкурсы,"[club791498|Национальный музей Республики Карелия] и [club12394249|Карельский центр развития добровольчества] приглашает жителей и гостей Петрозаводска принять участие в небольшом фото-конкурсе.   Что нужно? Просто прийти в Национальный музей, найти нашу мини-выставку «Фестиваль объединяет» и….   …сделать фотографию. Для любителей селфи мы приготовили специальную номинацию – «Селфи на фоне»: фотографируем себя или себя и друзей на фоне выставки. Чем необычнее и веселее будет фотография – тем лучше.   И вторая номинация «Экспонат» - найдите самый для себя интересный экспонат на выставке «Фестиваль объединяет», напишите почему он вам так понравился, попробуйте придумать его историю: как он попал к человеку, кто мог быть его владельцем и т.д. Можно и его заодно и сфотографировать ;)  Что дальше? Делаем пост в группе [club132667727|Центра волонтеров ВФМС2017 | Северо-Запад] и не забываем ставить хештеги: #национальныймузейкарелии #dobrocentr10 #фестивальобъединяет #WFYS2017 #ВФМС2017  Самым-самым мы вручим приятные памятные подарки)",2017-07-26 14:52:07,rk_nationalmuseum,museum
фестивали и конкурсы,"💫 Карелия – в числе лидеров всероссийского конкурса «Росмолодежь.Гранты»! Сразу 28 наших проектов признали победителями. На их реализацию будет направлено более 16 млн рублей.    У нас, действительно, самая талантливая молодежь! Все инициативы ребят - экологические, творческие, образовательные, спортивные - интересны и важны.    От души поздравляю! С нетерпением ждем старта проектов! Список победителей доступен по ссылке: https://vk.cc/cs9CqM  #НашаКарелия #Господдержка",2023-11-05 16:06:10,aparfenchikov,state
фестивали и конкурсы,"#хранители_смыслов || Конкурс лучших историй «Хранители смыслов»  В Международный день коренных народов, сегодня, 09 августа  команда Ассоциации «ЭХО» объявляет о старте конкурса лучших историй, идея которого — рассказать о​ людях, которые нас окружают и​ которые своим творчеством, трудом, отношением к​ жизни, привносят в​ наш мир что-то новое, светлое, интересное.  Мы​ собираем истории о​ наших современниках​ — ремесленниках, художниках, литераторах, фотографах, общественных деятелях, духовных лидерах, этнографах и​ их​ вкладе в​ местную культуру.  К​ участию приглашаются пишущие или начинающие писать жители Республики Карелия, Мурманской области и​ Красноярского края (Таймырского Долгано-Ненецкого муниципального района). Возраст участников не​ важен.  Свою историю об​ интересном человеке вы​ публикуете на​ личной странице в​ социальной сети «ВКонтакте» с​ обязательным указанием хештега.   Хештеги, которые можно использовать: #хранители_смыслов, #сельский_блогер, #люди_культуры, #коренные_народы.  Мы найдём ваши истории по​ обозначенным хештегам и​ опубликуем их​ в​ социальной сети «Вконтакте» (страница «Сельский блогер»).  Номинации конкурса: Лучшая история о​ ремесленник Лучшая история о​ художнике Лучшая история о​ писателе, поэте Лучшая история об​ общественном деятеле и​ духовном лидере  Лучшие работы будут отобраны для участия в​ фотовыставке, которая пройдёт в​ Петрозаводске. Победители будут награждены благодарственными письмами и​ призами, а работы-победители будут опубликованы на​ тематических интернет-ресурсах Ассоциации этнокультурных центров «ЭХО».  Сроки проведения Конкурса: 09​ августа​ — 20​ сентября​ — приём конкурсных работ 20​ сентября​ — 30​ сентября​ — оценка конкурсных работ 30​ сентября​ — объявление победителей _________________________  Конкурс проводится при содействии Фонда поддержки гуманитарных и​ просветительских инициатив «Соработничество» в рамках проекта «Хранители смыслов и​ знаний: продвижение традиционных ценностей через ремёсла и​ промыслы коренных народов».  Подробная информация о конкурсе по ссылке под постом.",2022-08-09 10:02:01,echo_association,museum
фестивали и конкурсы,"💫 На конкурс ""В поисках главной руны"" поступило очень много постановок и видеозарисовок, в которых главная роль была отведена карельским рунам.   Представляем Вашему вниманию работы победителей:   - Театр «Orvokki», постановка «Yksin meillä yöt tulevat, Yksin päivät valkeavat - По одной идут к нам ночи, Дни идут поодиночке».  Режиссер: Татьяна Федоровна Гребзде, актеры: участники [club161037608|Общества карельской культуры Viena].   - Детский сад №74 города Петрозаводска. Воспитатели логопедической группы ""Птички"" Шарова Надежда, Грацианова Мария, постановка ""Дети играют ""КАЛЕВАЛУ"".   #KarjalaisienRunojenVuosi #KarjalazienRunoloinVuozi #Kard’alaižiinRunoinVuoz’ #ГодКарельскихРун #КарельскиеСказители #руны",2021-06-15 17:31:00,desyatiletieyazykovkarelia,language
фестивали и конкурсы,"Друзья, продолжается прием заявок на конкурс «Лидеры России». Это действительно отличная возможность заявить о себе, реализовать свой потенциал и стать одним из тех, кто определяет будущее страны.    Не упускайте такой шанс! Тем более, конкурс – не только для уже опытных руководителей. В нем могут принять участие и новички, которые пришли в сферу управления недавно. Сегодня молодые и талантливые лидеры нужны и в бизнесе, и в государственном секторе.    У нас есть примеры земляков, которые достойно проявили себя и дошли до суперфинала. Например, в прошлом году в конкурсе «Лидеры России» победил Алексей Головинкин. После этого его пригласили на работу в Читу. Сегодня Алексей – министр ЖКХ, энергетики, цифровизации и связи Забайкальского края.    Так что дерзайте, друзья! И не откладывайте в долгий ящик – заявки принимают до 14 мая.    Вся информация – [https://vk.com/leadersofrussia|здесь] и на официальном сайте конкурса 👉 https://vk.cc/cno4AA    #ЛидерыРоссии #РоссияСтранаВозможностей",2023-04-24 7:07:00,aparfenchikov,state
фестивали и конкурсы,"6 июня, во время празднования Дня Республики в Сортавала, впервые в истории, состоится конкурс исполнителей эпических песен Карелии.  В год 180-летия первого издания эпоса «Калевала» в Карелии задумали возродить былую традицию исполнения эпических песен – рун и былин, которые принесли северному краю мировую известность. Центр национальных культур и народного творчества республики проводит конкурс, в котором могут принять сказители разных возрастов, следующие канонам прошлого или, напротив, ищущие новые формы.  Приветствуются разные стили и направления. Первый этап конкурса – заочный. Участникам достаточно предоставить видеозапись своего исполнения. Победители отборочного тура будут приглашены на День Республики в Сортавала (проезд и питание за счет организаторов конкурса) и выступят в гала-концерте.  Заявки на участие и видеоматериалы конкурсной работы  принимаются до 9 апреля на электронный адрес cnk-karelia@yandex.ru с пометкой «Конкурс» или по почте: 185035 г. Петрозаводск, пл. Ленина, 2 БУ «Центр национальных культур и народного творчества Республики Карелия». Подробную информацию можно получить по телефонам 8(8142)78-20-48 и 8(8142)76-46-89.",2015-03-20 20:36:54,echo_association,museum
фестивали и конкурсы,"Хотите выиграть микроволновую печь?    Участвуйте в Конкурсе летних букетов на [https://vk.com/wall-133122487_11746|Ильине Дне] в [club133122487|деревне Вокнаволок]! 💐    Подробности про Конкурс вы можете найти в наших карточках, а мы ждем встречи с вами 29 июля в старинной карельской деревне на самом атмосферном празднике лета!  ❗️ Ильин день переносится на 5 августа! Подробности: https://vk.cc/cpMD0x    #ДомДеревни #Вокнаволок #ЦентрСреда #Костомукша #ИльинДень #Карелия",2023-07-24 14:20:08,domderevnivoknavolok,museum
фестивали и конкурсы,"❄ПРИГЛАШАЕМ К УЧАСТИЮ В КОНКУРСЕ    Продолжается приём творческих работ на конкурс «Молодые северяне о себе и своем народе – Память Победы».    С 1 июня по 12 сентября 2022 года [https://vk.com/vkraipon|Ассоциация коренных малочисленных народов Севера, Сибири и Дальнего Востока] и Российский государственный гуманитарный университет проводят конкурс творческих работ «Молодые северяне о себе и своем народе – Память Победы».    К участию в Конкурсе приглашаются граждане РФ (от 18 до 35 лет) из числа коренных малочисленных народов Севера, Сибири и Дальнего Востока.    🔶 Срок предоставления работ до 12 сентября 2022 г.  🔷 Итоги конкурса будут объявлены 20 сентября 2022 г.    Конкурсная работа в виде эссе или видеоролика предоставляется по одной из следующих номинаций:    🔶Подвиг моего народа в Великой отечественной войне на фронтах и в тылу;  🔶Память Победы в моем городе / поселке / деревне / стойбище;  🔶Великая отечественная война в истории моей семьи;  🔶Герои моего народа в Бессмертном полку;  🔶Мой вклад в сохранении героической памяти моего народа в годы Великой отечественной войны.    ✉ Заявки и творческие работы можно направить на адрес: konkurs-kmns@rggu.ru    Ознакомиться с положением о конкурсе можно ⬇",2022-07-18 10:05:00,etnodomrk,festival
